defined_class	defined_class_label	entity	entity_label
http://purl.obolibrary.org/obo/GO_0002899	negative regulation of central B cell deletion	http://purl.obolibrary.org/obo/GO_0002342	central B cell deletion
http://purl.obolibrary.org/obo/GO_0002896	negative regulation of central B cell tolerance induction	http://purl.obolibrary.org/obo/GO_0002510	central B cell tolerance induction
http://purl.obolibrary.org/obo/GO_0002647	negative regulation of central tolerance induction	http://purl.obolibrary.org/obo/GO_0002508	central tolerance induction
http://purl.obolibrary.org/obo/GO_1903723	negative regulation of centriole elongation	http://purl.obolibrary.org/obo/GO_0061511	centriole elongation
http://purl.obolibrary.org/obo/GO_0046600	negative regulation of centriole replication	http://purl.obolibrary.org/obo/GO_0007099	centriole replication
http://purl.obolibrary.org/obo/GO_1903126	negative regulation of centriole-centriole cohesion	http://purl.obolibrary.org/obo/GO_0010457	centriole-centriole cohesion
http://purl.obolibrary.org/obo/GO_0046606	negative regulation of centrosome cycle	http://purl.obolibrary.org/obo/GO_0007098	centrosome cycle
http://purl.obolibrary.org/obo/GO_0010826	negative regulation of centrosome duplication	http://purl.obolibrary.org/obo/GO_0051298	centrosome duplication
http://purl.obolibrary.org/obo/GO_1900060	negative regulation of ceramide biosynthetic process	http://purl.obolibrary.org/obo/GO_0046513	ceramide biosynthetic process
http://purl.obolibrary.org/obo/GO_0021941	negative regulation of cerebellar granule cell precursor proliferation	http://purl.obolibrary.org/obo/GO_0021930	cerebellar granule cell precursor proliferation
http://purl.obolibrary.org/obo/GO_1905080	negative regulation of cerebellar neuron development	http://purl.obolibrary.org/obo/GO_0098749	cerebellar neuron development
http://purl.obolibrary.org/obo/GO_0120278	negative regulation of cerebral blood circulation	http://purl.obolibrary.org/obo/GO_0120275	cerebral blood circulation
http://purl.obolibrary.org/obo/GO_1900647	negative regulation of chanoclavine-I aldehyde biosynthetic process	http://purl.obolibrary.org/obo/GO_1900569	chanoclavine-I aldehyde biosynthetic process
http://purl.obolibrary.org/obo/GO_1904715	negative regulation of chaperone-mediated autophagy	http://purl.obolibrary.org/obo/GO_0061684	chaperone-mediated autophagy
http://purl.obolibrary.org/obo/GO_1903645	negative regulation of chaperone-mediated protein folding	http://purl.obolibrary.org/obo/GO_0061077	chaperone-mediated protein folding
http://purl.obolibrary.org/obo/GO_0071653	negative regulation of chemokine (C-C motif) ligand 1 production	http://purl.obolibrary.org/obo/GO_0071610	chemokine (C-C motif) ligand 1 production
http://purl.obolibrary.org/obo/GO_1903885	negative regulation of chemokine (C-C motif) ligand 20 production	http://purl.obolibrary.org/obo/GO_0036392	chemokine (C-C motif) ligand 20 production
http://purl.obolibrary.org/obo/GO_0071644	negative regulation of chemokine (C-C motif) ligand 4 production	http://purl.obolibrary.org/obo/GO_0071606	chemokine (C-C motif) ligand 4 production
http://purl.obolibrary.org/obo/GO_0071650	negative regulation of chemokine (C-C motif) ligand 5 production	http://purl.obolibrary.org/obo/GO_0071609	chemokine (C-C motif) ligand 5 production
http://purl.obolibrary.org/obo/GO_0035532	negative regulation of chemokine (C-C motif) ligand 6 production	http://purl.obolibrary.org/obo/GO_0035530	chemokine (C-C motif) ligand 6 production
http://purl.obolibrary.org/obo/GO_2000339	negative regulation of chemokine (C-X-C motif) ligand 1 production	http://purl.obolibrary.org/obo/GO_0072566	chemokine (C-X-C motif) ligand 1 production
http://purl.obolibrary.org/obo/GO_2000342	negative regulation of chemokine (C-X-C motif) ligand 2 production	http://purl.obolibrary.org/obo/GO_0072567	chemokine (C-X-C motif) ligand 2 production
http://purl.obolibrary.org/obo/GO_0035395	negative regulation of chemokine (C-X-C motif) ligand 9 production	http://purl.obolibrary.org/obo/GO_0035393	chemokine (C-X-C motif) ligand 9 production
http://purl.obolibrary.org/obo/GO_1900137	negative regulation of chemokine activity	http://purl.obolibrary.org/obo/GO_0008009	chemokine activity
http://purl.obolibrary.org/obo/GO_0032682	negative regulation of chemokine production	http://purl.obolibrary.org/obo/GO_0032602	chemokine production
http://purl.obolibrary.org/obo/GO_0070100	negative regulation of chemokine-mediated signaling pathway	http://purl.obolibrary.org/obo/GO_0070098	chemokine-mediated signaling pathway
http://purl.obolibrary.org/obo/GO_1904366	negative regulation of chemokinesis	http://purl.obolibrary.org/obo/GO_0042466	chemokinesis
http://purl.obolibrary.org/obo/GO_1903668	negative regulation of chemorepellent activity	http://purl.obolibrary.org/obo/GO_0045499	chemorepellent activity
http://purl.obolibrary.org/obo/GO_0050922	negative regulation of chemotaxis	http://purl.obolibrary.org/obo/GO_0006935	chemotaxis
http://purl.obolibrary.org/obo/GO_1904553	negative regulation of chemotaxis to arachidonic acid	http://purl.obolibrary.org/obo/GO_0034670	chemotaxis to arachidonic acid
http://purl.obolibrary.org/obo/GO_0045800	negative regulation of chitin-based cuticle tanning	http://purl.obolibrary.org/obo/GO_0007593	chitin-based cuticle sclerotization
http://purl.obolibrary.org/obo/GO_2001226	negative regulation of chloride transport	http://purl.obolibrary.org/obo/GO_0006821	chloride transport
http://purl.obolibrary.org/obo/GO_1902325	negative regulation of chlorophyll biosynthetic process	http://purl.obolibrary.org/obo/GO_0015995	chlorophyll biosynthetic process
http://purl.obolibrary.org/obo/GO_1903647	negative regulation of chlorophyll catabolic process	http://purl.obolibrary.org/obo/GO_0015996	chlorophyll catabolic process
http://purl.obolibrary.org/obo/GO_1905193	negative regulation of chloroplast fission	http://purl.obolibrary.org/obo/GO_0010020	chloroplast fission
http://purl.obolibrary.org/obo/GO_1904193	negative regulation of cholangiocyte apoptotic process	http://purl.obolibrary.org/obo/GO_1902488	cholangiocyte apoptotic process
http://purl.obolibrary.org/obo/GO_1904055	negative regulation of cholangiocyte proliferation	http://purl.obolibrary.org/obo/GO_1990705	cholangiocyte proliferation
http://purl.obolibrary.org/obo/GO_0045541	negative regulation of cholesterol biosynthetic process	http://purl.obolibrary.org/obo/GO_0006695	cholesterol biosynthetic process
http://purl.obolibrary.org/obo/GO_0090370	negative regulation of cholesterol efflux	http://purl.obolibrary.org/obo/GO_0033344	cholesterol efflux
http://purl.obolibrary.org/obo/GO_0060621	negative regulation of cholesterol import	http://purl.obolibrary.org/obo/GO_0070508	cholesterol import
http://purl.obolibrary.org/obo/GO_0090206	negative regulation of cholesterol metabolic process	http://purl.obolibrary.org/obo/GO_0008203	cholesterol metabolic process
http://purl.obolibrary.org/obo/GO_0010887	negative regulation of cholesterol storage	http://purl.obolibrary.org/obo/GO_0010878	cholesterol storage
http://purl.obolibrary.org/obo/GO_0032375	negative regulation of cholesterol transport	http://purl.obolibrary.org/obo/GO_0030301	cholesterol transport
http://purl.obolibrary.org/obo/GO_0060695	negative regulation of cholesterol transporter activity	http://purl.obolibrary.org/obo/GO_0120020	cholesterol transfer activity
http://purl.obolibrary.org/obo/GO_1902770	negative regulation of choline O-acetyltransferase activity	http://purl.obolibrary.org/obo/GO_0004102	choline O-acetyltransferase activity
http://purl.obolibrary.org/obo/GO_0061182	negative regulation of chondrocyte development	http://purl.obolibrary.org/obo/GO_0002063	chondrocyte development
http://purl.obolibrary.org/obo/GO_0032331	negative regulation of chondrocyte differentiation	http://purl.obolibrary.org/obo/GO_0002062	chondrocyte differentiation
http://purl.obolibrary.org/obo/GO_1903042	negative regulation of chondrocyte hypertrophy	http://purl.obolibrary.org/obo/GO_0003415	chondrocyte hypertrophy
http://purl.obolibrary.org/obo/GO_1902731	negative regulation of chondrocyte proliferation	http://purl.obolibrary.org/obo/GO_0035988	chondrocyte proliferation
http://purl.obolibrary.org/obo/GO_1901383	negative regulation of chorionic trophoblast cell proliferation	http://purl.obolibrary.org/obo/GO_0097360	chorionic trophoblast cell proliferation
http://purl.obolibrary.org/obo/GO_0035562	negative regulation of chromatin binding	http://purl.obolibrary.org/obo/GO_0003682	chromatin binding
http://purl.obolibrary.org/obo/GO_1905268	negative regulation of chromatin organization	http://purl.obolibrary.org/obo/GO_0006325	chromatin organization
http://purl.obolibrary.org/obo/GO_0120265	negative regulation of chromosome attachment to the nuclear envelope	http://purl.obolibrary.org/obo/GO_0097240	chromosome attachment to the nuclear envelope
http://purl.obolibrary.org/obo/GO_1902340	negative regulation of chromosome condensation	http://purl.obolibrary.org/obo/GO_0030261	chromosome condensation
http://purl.obolibrary.org/obo/GO_2001251	negative regulation of chromosome organization	http://purl.obolibrary.org/obo/GO_0051276	chromosome organization
http://purl.obolibrary.org/obo/GO_0051985	negative regulation of chromosome segregation	http://purl.obolibrary.org/obo/GO_0007059	chromosome segregation
http://purl.obolibrary.org/obo/GO_1905819	negative regulation of chromosome separation	http://purl.obolibrary.org/obo/GO_0051304	chromosome separation
http://purl.obolibrary.org/obo/GO_0002677	negative regulation of chronic inflammatory response	http://purl.obolibrary.org/obo/GO_0002544	chronic inflammatory response
http://purl.obolibrary.org/obo/GO_0002875	negative regulation of chronic inflammatory response to antigenic stimulus	http://purl.obolibrary.org/obo/GO_0002439	chronic inflammatory response to antigenic stimulus
http://purl.obolibrary.org/obo/GO_0002881	negative regulation of chronic inflammatory response to non-antigenic stimulus	http://purl.obolibrary.org/obo/GO_0002545	chronic inflammatory response to non-antigenic stimulus
http://purl.obolibrary.org/obo/GO_1902018	negative regulation of cilium assembly	http://purl.obolibrary.org/obo/GO_0060271	cilium assembly
http://purl.obolibrary.org/obo/GO_0003354	negative regulation of cilium movement	http://purl.obolibrary.org/obo/GO_0003341	cilium movement
http://purl.obolibrary.org/obo/GO_1902020	negative regulation of cilium-dependent cell motility	http://purl.obolibrary.org/obo/GO_0060285	cilium-dependent cell motility
http://purl.obolibrary.org/obo/GO_0042754	negative regulation of circadian rhythm	http://purl.obolibrary.org/obo/GO_0007623	circadian rhythm
http://purl.obolibrary.org/obo/GO_0042322	negative regulation of circadian sleep/wake cycle, REM sleep	http://purl.obolibrary.org/obo/GO_0042747	circadian sleep/wake cycle, REM sleep
http://purl.obolibrary.org/obo/GO_0042323	negative regulation of circadian sleep/wake cycle, non-REM sleep	http://purl.obolibrary.org/obo/GO_0042748	circadian sleep/wake cycle, non-REM sleep
http://purl.obolibrary.org/obo/GO_0042321	negative regulation of circadian sleep/wake cycle, sleep	http://purl.obolibrary.org/obo/GO_0050802	circadian sleep/wake cycle, sleep
http://purl.obolibrary.org/obo/GO_1904326	negative regulation of circadian sleep/wake cycle, wakefulness	http://purl.obolibrary.org/obo/GO_0042746	circadian sleep/wake cycle, wakefulness
http://purl.obolibrary.org/obo/GO_1903249	negative regulation of citrulline biosynthetic process	http://purl.obolibrary.org/obo/GO_0019240	citrulline biosynthetic process
http://purl.obolibrary.org/obo/GO_1905444	negative regulation of clathrin coat assembly	http://purl.obolibrary.org/obo/GO_0048268	clathrin coat assembly
http://purl.obolibrary.org/obo/GO_1900186	negative regulation of clathrin-dependent endocytosis	http://purl.obolibrary.org/obo/GO_0072583	clathrin-dependent endocytosis
http://purl.obolibrary.org/obo/GO_0070797	negative regulation of cleistothecium development	http://purl.obolibrary.org/obo/GO_0070791	cleistothecium development
http://purl.obolibrary.org/obo/GO_0050819	negative regulation of coagulation	http://purl.obolibrary.org/obo/GO_0050817	coagulation
http://purl.obolibrary.org/obo/GO_0106122	negative regulation of cobalamin metabolic process	http://purl.obolibrary.org/obo/GO_0009235	cobalamin metabolic process
http://purl.obolibrary.org/obo/GO_1900289	negative regulation of coenzyme F420-dependent bicyclic nitroimidazole catabolic process	http://purl.obolibrary.org/obo/GO_0052799	coenzyme F420-dependent bicyclic nitroimidazole catabolic process
http://purl.obolibrary.org/obo/GO_0071923	negative regulation of cohesin loading	http://purl.obolibrary.org/obo/GO_0071921	cohesin loading
http://purl.obolibrary.org/obo/GO_1905338	negative regulation of cohesin unloading	http://purl.obolibrary.org/obo/GO_0061774	cohesin unloading
http://purl.obolibrary.org/obo/GO_0120163	negative regulation of cold-induced thermogenesis	http://purl.obolibrary.org/obo/GO_0106106	cold-induced thermogenesis
http://purl.obolibrary.org/obo/GO_0033342	negative regulation of collagen binding	http://purl.obolibrary.org/obo/GO_0005518	collagen binding
http://purl.obolibrary.org/obo/GO_0032966	negative regulation of collagen biosynthetic process	http://purl.obolibrary.org/obo/GO_0032964	collagen biosynthetic process
http://purl.obolibrary.org/obo/GO_0010711	negative regulation of collagen catabolic process	http://purl.obolibrary.org/obo/GO_0030574	collagen catabolic process
http://purl.obolibrary.org/obo/GO_1904027	negative regulation of collagen fibril organization	http://purl.obolibrary.org/obo/GO_0030199	collagen fibril organization
http://purl.obolibrary.org/obo/GO_0010713	negative regulation of collagen metabolic process	http://purl.obolibrary.org/obo/GO_0032963	collagen metabolic process
http://purl.obolibrary.org/obo/GO_0048671	negative regulation of collateral sprouting	http://purl.obolibrary.org/obo/GO_0048668	collateral sprouting
http://purl.obolibrary.org/obo/GO_0048698	negative regulation of collateral sprouting in absence of injury	http://purl.obolibrary.org/obo/GO_0048669	collateral sprouting in absence of injury
http://purl.obolibrary.org/obo/GO_0048695	negative regulation of collateral sprouting of injured axon	http://purl.obolibrary.org/obo/GO_0048674	collateral sprouting of injured axon
http://purl.obolibrary.org/obo/GO_0048685	negative regulation of collateral sprouting of intact axon in response to injury	http://purl.obolibrary.org/obo/GO_0048673	collateral sprouting of intact axon in response to injury
http://purl.obolibrary.org/obo/GO_1903815	negative regulation of collecting lymphatic vessel constriction	http://purl.obolibrary.org/obo/GO_1990192	collecting lymphatic vessel constriction
http://purl.obolibrary.org/obo/GO_1904342	negative regulation of colon smooth muscle contraction	http://purl.obolibrary.org/obo/GO_1990765	colon smooth muscle contraction
http://purl.obolibrary.org/obo/GO_0045916	negative regulation of complement activation	http://purl.obolibrary.org/obo/GO_0006956	complement activation
http://purl.obolibrary.org/obo/GO_0045957	negative regulation of complement activation, alternative pathway	http://purl.obolibrary.org/obo/GO_0006957	complement activation, alternative pathway
http://purl.obolibrary.org/obo/GO_0045959	negative regulation of complement activation, classical pathway	http://purl.obolibrary.org/obo/GO_0006958	complement activation, classical pathway
http://purl.obolibrary.org/obo/GO_0001869	negative regulation of complement activation, lectin pathway	http://purl.obolibrary.org/obo/GO_0001867	complement activation, lectin pathway
http://purl.obolibrary.org/obo/GO_1903660	negative regulation of complement-dependent cytotoxicity	http://purl.obolibrary.org/obo/GO_0097278	complement-dependent cytotoxicity
http://purl.obolibrary.org/obo/GO_0042683	negative regulation of compound eye cone cell fate specification	http://purl.obolibrary.org/obo/GO_0042679	compound eye cone cell fate specification
http://purl.obolibrary.org/obo/GO_0110118	negative regulation of compound eye photoreceptor cell differentiation	http://purl.obolibrary.org/obo/GO_0001751	compound eye photoreceptor cell differentiation
http://purl.obolibrary.org/obo/GO_0045316	negative regulation of compound eye photoreceptor development	http://purl.obolibrary.org/obo/GO_0042051	compound eye photoreceptor development
http://purl.obolibrary.org/obo/GO_0048077	negative regulation of compound eye pigmentation	http://purl.obolibrary.org/obo/GO_0048072	compound eye pigmentation
http://purl.obolibrary.org/obo/GO_1901693	negative regulation of compound eye retinal cell apoptotic process	http://purl.obolibrary.org/obo/GO_1990010	compound eye retinal cell apoptotic process
http://purl.obolibrary.org/obo/GO_0046673	negative regulation of compound eye retinal cell programmed cell death	http://purl.obolibrary.org/obo/GO_0046667	compound eye retinal cell programmed cell death
http://purl.obolibrary.org/obo/GO_0070794	negative regulation of conidiophore development	http://purl.obolibrary.org/obo/GO_0070787	conidiophore development
http://purl.obolibrary.org/obo/GO_0070800	negative regulation of conidiophore stalk development	http://purl.obolibrary.org/obo/GO_0070788	conidiophore stalk development
http://purl.obolibrary.org/obo/GO_0075308	negative regulation of conidium formation	http://purl.obolibrary.org/obo/GO_0048315	conidium formation
http://purl.obolibrary.org/obo/GO_0031138	negative regulation of conjugation with cellular fusion	http://purl.obolibrary.org/obo/GO_0000747	conjugation with cellular fusion
http://purl.obolibrary.org/obo/GO_0032683	negative regulation of connective tissue growth factor production	http://purl.obolibrary.org/obo/GO_0032601	connective tissue growth factor production
http://purl.obolibrary.org/obo/GO_1905204	negative regulation of connective tissue replacement	http://purl.obolibrary.org/obo/GO_0097709	connective tissue replacement
http://purl.obolibrary.org/obo/GO_1904597	negative regulation of connective tissue replacement involved in inflammatory response wound healing	http://purl.obolibrary.org/obo/GO_0002248	connective tissue replacement involved in inflammatory response wound healing
http://purl.obolibrary.org/obo/GO_1903434	negative regulation of constitutive secretory pathway	http://purl.obolibrary.org/obo/GO_0045054	constitutive secretory pathway
http://purl.obolibrary.org/obo/GO_1901233	negative regulation of convergent extension involved in axis elongation	http://purl.obolibrary.org/obo/GO_0060028	convergent extension involved in axis elongation
http://purl.obolibrary.org/obo/GO_1904104	negative regulation of convergent extension involved in gastrulation	http://purl.obolibrary.org/obo/GO_0060027	convergent extension involved in gastrulation
http://purl.obolibrary.org/obo/GO_1904131	negative regulation of convergent extension involved in neural plate elongation	http://purl.obolibrary.org/obo/GO_0022007	convergent extension involved in neural plate elongation
http://purl.obolibrary.org/obo/GO_1904137	negative regulation of convergent extension involved in notochord morphogenesis	http://purl.obolibrary.org/obo/GO_1904126	convergent extension involved in notochord morphogenesis
http://purl.obolibrary.org/obo/GO_1904134	negative regulation of convergent extension involved in rhombomere morphogenesis	http://purl.obolibrary.org/obo/GO_1904125	convergent extension involved in rhombomere morphogenesis
http://purl.obolibrary.org/obo/GO_1904128	negative regulation of convergent extension involved in somitogenesis	http://purl.obolibrary.org/obo/GO_0090246	convergent extension involved in somitogenesis
http://purl.obolibrary.org/obo/GO_1902312	negative regulation of copper ion transmembrane transport	http://purl.obolibrary.org/obo/GO_0035434	copper ion transmembrane transport
http://purl.obolibrary.org/obo/GO_1900862	negative regulation of cordyol C biosynthetic process	http://purl.obolibrary.org/obo/GO_1900799	cordyol C biosynthetic process
http://purl.obolibrary.org/obo/GO_1904797	negative regulation of core promoter binding	http://purl.obolibrary.org/obo/GO_0001046	core promoter sequence-specific DNA binding
http://purl.obolibrary.org/obo/GO_1905716	negative regulation of cornification	http://purl.obolibrary.org/obo/GO_0070268	cornification
http://purl.obolibrary.org/obo/GO_2000847	negative regulation of corticosteroid hormone secretion	http://purl.obolibrary.org/obo/GO_0035930	corticosteroid hormone secretion
http://purl.obolibrary.org/obo/GO_2000853	negative regulation of corticosterone secretion	http://purl.obolibrary.org/obo/GO_0035934	corticosterone secretion
http://purl.obolibrary.org/obo/GO_0051460	negative regulation of corticotropin secretion	http://purl.obolibrary.org/obo/GO_0051458	corticotropin secretion
http://purl.obolibrary.org/obo/GO_1900011	negative regulation of corticotropin-releasing hormone receptor activity	http://purl.obolibrary.org/obo/GO_0043404	corticotropin-releasing hormone receptor activity
http://purl.obolibrary.org/obo/GO_0051465	negative regulation of corticotropin-releasing hormone secretion	http://purl.obolibrary.org/obo/GO_0043396	corticotropin-releasing hormone secretion
http://purl.obolibrary.org/obo/GO_2000065	negative regulation of cortisol biosynthetic process	http://purl.obolibrary.org/obo/GO_0034651	cortisol biosynthetic process
http://purl.obolibrary.org/obo/GO_0051463	negative regulation of cortisol secretion	http://purl.obolibrary.org/obo/GO_0043400	cortisol secretion
http://purl.obolibrary.org/obo/GO_1905408	negative regulation of creatine transmembrane transporter activity	http://purl.obolibrary.org/obo/GO_0005308	creatine transmembrane transporter activity
http://purl.obolibrary.org/obo/GO_1903851	negative regulation of cristae formation	http://purl.obolibrary.org/obo/GO_0042407	cristae formation
http://purl.obolibrary.org/obo/GO_0042690	negative regulation of crystal cell differentiation	http://purl.obolibrary.org/obo/GO_0042688	crystal cell differentiation
http://purl.obolibrary.org/obo/GO_0045593	negative regulation of cumulus cell differentiation	http://purl.obolibrary.org/obo/GO_0001549	cumulus cell differentiation
http://purl.obolibrary.org/obo/GO_0048080	negative regulation of cuticle pigmentation	http://purl.obolibrary.org/obo/GO_0048067	cuticle pigmentation
http://purl.obolibrary.org/obo/GO_1901958	negative regulation of cutin biosynthetic process	http://purl.obolibrary.org/obo/GO_0010143	cutin biosynthetic process
http://purl.obolibrary.org/obo/GO_0048782	negative regulation of cyanophore differentiation	http://purl.obolibrary.org/obo/GO_0048774	cyanophore differentiation
http://purl.obolibrary.org/obo/GO_0031280	negative regulation of cyclase activity	http://purl.obolibrary.org/obo/GO_0009975	cyclase activity
http://purl.obolibrary.org/obo/GO_1902160	negative regulation of cyclic nucleotide-gated ion channel activity	http://purl.obolibrary.org/obo/GO_0043855	cyclic nucleotide-gated monoatomic ion channel activity
http://purl.obolibrary.org/obo/GO_0051344	negative regulation of cyclic-nucleotide phosphodiesterase activity	http://purl.obolibrary.org/obo/GO_0004112	cyclic-nucleotide phosphodiesterase activity
http://purl.obolibrary.org/obo/GO_1904030	negative regulation of cyclin-dependent protein kinase activity	http://purl.obolibrary.org/obo/GO_0097472	cyclin-dependent protein kinase activity
http://purl.obolibrary.org/obo/GO_0045736	negative regulation of cyclin-dependent protein serine/threonine kinase activity	http://purl.obolibrary.org/obo/GO_0004693	cyclin-dependent protein serine/threonine kinase activity
http://purl.obolibrary.org/obo/GO_2000958	negative regulation of cyclodextrin catabolic process	http://purl.obolibrary.org/obo/GO_2000901	cyclodextrin catabolic process
http://purl.obolibrary.org/obo/GO_2000955	negative regulation of cyclodextrin metabolic process	http://purl.obolibrary.org/obo/GO_2000900	cyclodextrin metabolic process
http://purl.obolibrary.org/obo/GO_1904042	negative regulation of cystathionine beta-synthase activity	http://purl.obolibrary.org/obo/GO_0004122	cystathionine beta-synthase activity
http://purl.obolibrary.org/obo/GO_1901495	negative regulation of cysteine metabolic process	http://purl.obolibrary.org/obo/GO_0006534	cysteine metabolic process
http://purl.obolibrary.org/obo/GO_2000117	negative regulation of cysteine-type endopeptidase activity	http://purl.obolibrary.org/obo/GO_0004197	cysteine-type endopeptidase activity
http://purl.obolibrary.org/obo/GO_0043154	negative regulation of cysteine-type endopeptidase activity involved in apoptotic process	http://purl.obolibrary.org/obo/GO_0097153	cysteine-type endopeptidase activity involved in apoptotic process
http://purl.obolibrary.org/obo/GO_2001268	negative regulation of cysteine-type endopeptidase activity involved in apoptotic signaling pathway	http://purl.obolibrary.org/obo/GO_0097199	cysteine-type endopeptidase activity involved in apoptotic signaling pathway
http://purl.obolibrary.org/obo/GO_2001271	negative regulation of cysteine-type endopeptidase activity involved in execution phase of apoptosis	http://purl.obolibrary.org/obo/GO_0097200	cysteine-type endopeptidase activity involved in execution phase of apoptosis
http://purl.obolibrary.org/obo/GO_1905376	negative regulation of cytochrome-c oxidase activity	http://purl.obolibrary.org/obo/GO_0004129	cytochrome-c oxidase activity
http://purl.obolibrary.org/obo/GO_0060302	negative regulation of cytokine activity	http://purl.obolibrary.org/obo/GO_0005125	cytokine activity
http://purl.obolibrary.org/obo/GO_0001818	negative regulation of cytokine production	http://purl.obolibrary.org/obo/GO_0001816	cytokine production
