defined_class	defined_class_label	entity	entity_label
http://purl.obolibrary.org/obo/GO_0032384	negative regulation of intracellular cholesterol transport	http://purl.obolibrary.org/obo/GO_0032367	intracellular cholesterol transport
http://purl.obolibrary.org/obo/GO_0033147	negative regulation of intracellular estrogen receptor signaling pathway	http://purl.obolibrary.org/obo/GO_0030520	intracellular estrogen receptor signaling pathway
http://purl.obolibrary.org/obo/GO_0032378	negative regulation of intracellular lipid transport	http://purl.obolibrary.org/obo/GO_0032365	intracellular lipid transport
http://purl.obolibrary.org/obo/GO_1904581	negative regulation of intracellular mRNA localization	http://purl.obolibrary.org/obo/GO_0008298	intracellular mRNA localization
http://purl.obolibrary.org/obo/GO_0090317	negative regulation of intracellular protein transport	http://purl.obolibrary.org/obo/GO_0006886	intracellular protein transport
http://purl.obolibrary.org/obo/GO_1902532	negative regulation of intracellular signal transduction	http://purl.obolibrary.org/obo/GO_0035556	intracellular signal transduction
http://purl.obolibrary.org/obo/GO_0033144	negative regulation of intracellular steroid hormone receptor signaling pathway	http://purl.obolibrary.org/obo/GO_0030518	intracellular steroid hormone receptor signaling pathway
http://purl.obolibrary.org/obo/GO_0032381	negative regulation of intracellular sterol transport	http://purl.obolibrary.org/obo/GO_0032366	intracellular sterol transport
http://purl.obolibrary.org/obo/GO_0032387	negative regulation of intracellular transport	http://purl.obolibrary.org/obo/GO_0046907	intracellular transport
http://purl.obolibrary.org/obo/GO_1901253	negative regulation of intracellular transport of viral material	http://purl.obolibrary.org/obo/GO_0075733	intracellular transport of virus
http://purl.obolibrary.org/obo/GO_1905797	negative regulation of intraciliary anterograde transport	http://purl.obolibrary.org/obo/GO_0035720	intraciliary anterograde transport
http://purl.obolibrary.org/obo/GO_1905800	negative regulation of intraciliary retrograde transport	http://purl.obolibrary.org/obo/GO_0035721	intraciliary retrograde transport
http://purl.obolibrary.org/obo/GO_1905366	negative regulation of intralumenal vesicle formation	http://purl.obolibrary.org/obo/GO_0070676	intralumenal vesicle formation
http://purl.obolibrary.org/obo/GO_2001243	negative regulation of intrinsic apoptotic signaling pathway	http://purl.obolibrary.org/obo/GO_0097193	intrinsic apoptotic signaling pathway
http://purl.obolibrary.org/obo/GO_1902254	negative regulation of intrinsic apoptotic signaling pathway by p53 class mediator	http://purl.obolibrary.org/obo/GO_0072332	intrinsic apoptotic signaling pathway by p53 class mediator
http://purl.obolibrary.org/obo/GO_1902230	negative regulation of intrinsic apoptotic signaling pathway in response to DNA damage	http://purl.obolibrary.org/obo/GO_0008630	intrinsic apoptotic signaling pathway in response to DNA damage
http://purl.obolibrary.org/obo/GO_1902166	negative regulation of intrinsic apoptotic signaling pathway in response to DNA damage by p53 class mediator	http://purl.obolibrary.org/obo/GO_0042771	intrinsic apoptotic signaling pathway in response to DNA damage by p53 class mediator
http://purl.obolibrary.org/obo/GO_1903751	negative regulation of intrinsic apoptotic signaling pathway in response to hydrogen peroxide	http://purl.obolibrary.org/obo/GO_0036481	intrinsic apoptotic signaling pathway in response to hydrogen peroxide
http://purl.obolibrary.org/obo/GO_1902219	negative regulation of intrinsic apoptotic signaling pathway in response to osmotic stress	http://purl.obolibrary.org/obo/GO_0008627	intrinsic apoptotic signaling pathway in response to osmotic stress
http://purl.obolibrary.org/obo/GO_1902239	negative regulation of intrinsic apoptotic signaling pathway in response to osmotic stress by p53 class mediator	http://purl.obolibrary.org/obo/GO_1990127	intrinsic apoptotic signaling pathway in response to osmotic stress by p53 class mediator
http://purl.obolibrary.org/obo/GO_2000218	negative regulation of invasive growth in response to glucose limitation	http://purl.obolibrary.org/obo/GO_0001403	invasive growth in response to glucose limitation
http://purl.obolibrary.org/obo/GO_1903609	negative regulation of inward rectifier potassium channel activity	http://purl.obolibrary.org/obo/GO_0005242	inward rectifier potassium channel activity
http://purl.obolibrary.org/obo/GO_1904213	negative regulation of iodide transmembrane transport	http://purl.obolibrary.org/obo/GO_1904200	iodide transmembrane transport
http://purl.obolibrary.org/obo/GO_1904202	negative regulation of iodide transport	http://purl.obolibrary.org/obo/GO_0015705	iodide transport
http://purl.obolibrary.org/obo/GO_0032413	negative regulation of ion transmembrane transporter activity	http://purl.obolibrary.org/obo/GO_0015075	monoatomic ion transmembrane transporter activity
http://purl.obolibrary.org/obo/GO_0050943	negative regulation of iridophore differentiation	http://purl.obolibrary.org/obo/GO_0050935	iridophore differentiation
http://purl.obolibrary.org/obo/GO_1904039	negative regulation of iron export across plasma membrane	http://purl.obolibrary.org/obo/GO_1903988	iron ion export across plasma membrane
http://purl.obolibrary.org/obo/GO_1904439	negative regulation of iron ion import across plasma membrane	http://purl.obolibrary.org/obo/GO_0098711	iron ion import across plasma membrane
http://purl.obolibrary.org/obo/GO_0034760	negative regulation of iron ion transmembrane transport	http://purl.obolibrary.org/obo/GO_0034755	iron ion transmembrane transport
http://purl.obolibrary.org/obo/GO_1904255	negative regulation of iron ion transmembrane transporter activity	http://purl.obolibrary.org/obo/GO_0005381	iron ion transmembrane transporter activity
http://purl.obolibrary.org/obo/GO_0034757	negative regulation of iron ion transport	http://purl.obolibrary.org/obo/GO_0006826	iron ion transport
http://purl.obolibrary.org/obo/GO_1903330	negative regulation of iron-sulfur cluster assembly	http://purl.obolibrary.org/obo/GO_0016226	iron-sulfur cluster assembly
http://purl.obolibrary.org/obo/GO_1900507	negative regulation of iron-sulfur-molybdenum cofactor assembly	http://purl.obolibrary.org/obo/GO_0044593	iron-sulfur-molybdenum cofactor assembly
http://purl.obolibrary.org/obo/GO_0010323	negative regulation of isopentenyl diphosphate biosynthetic process, methylerythritol 4-phosphate pathway	http://purl.obolibrary.org/obo/GO_0019288	isopentenyl diphosphate biosynthetic process, methylerythritol 4-phosphate pathway
http://purl.obolibrary.org/obo/GO_2001211	negative regulation of isopentenyl diphosphate biosynthetic process, mevalonate pathway	http://purl.obolibrary.org/obo/GO_0019287	isopentenyl diphosphate biosynthetic process, mevalonate pathway
http://purl.obolibrary.org/obo/GO_1900948	negative regulation of isoprene biosynthetic process	http://purl.obolibrary.org/obo/GO_0043612	isoprene biosynthetic process
http://purl.obolibrary.org/obo/GO_1900945	negative regulation of isoprene metabolic process	http://purl.obolibrary.org/obo/GO_0043611	isoprene metabolic process
http://purl.obolibrary.org/obo/GO_0045827	negative regulation of isoprenoid metabolic process	http://purl.obolibrary.org/obo/GO_0006720	isoprenoid metabolic process
http://purl.obolibrary.org/obo/GO_0045829	negative regulation of isotype switching	http://purl.obolibrary.org/obo/GO_0045190	isotype switching
http://purl.obolibrary.org/obo/GO_0048297	negative regulation of isotype switching to IgA isotypes	http://purl.obolibrary.org/obo/GO_0048290	isotype switching to IgA isotypes
http://purl.obolibrary.org/obo/GO_0048300	negative regulation of isotype switching to IgD isotypes	http://purl.obolibrary.org/obo/GO_0048292	isotype switching to IgD isotypes
http://purl.obolibrary.org/obo/GO_0048294	negative regulation of isotype switching to IgE isotypes	http://purl.obolibrary.org/obo/GO_0048289	isotype switching to IgE isotypes
http://purl.obolibrary.org/obo/GO_0048303	negative regulation of isotype switching to IgG isotypes	http://purl.obolibrary.org/obo/GO_0048291	isotype switching to IgG isotypes
http://purl.obolibrary.org/obo/GO_0045968	negative regulation of juvenile hormone biosynthetic process	http://purl.obolibrary.org/obo/GO_0006718	juvenile hormone biosynthetic process
http://purl.obolibrary.org/obo/GO_0045970	negative regulation of juvenile hormone catabolic process	http://purl.obolibrary.org/obo/GO_0006719	juvenile hormone catabolic process
http://purl.obolibrary.org/obo/GO_0045928	negative regulation of juvenile hormone metabolic process	http://purl.obolibrary.org/obo/GO_0006716	juvenile hormone metabolic process
http://purl.obolibrary.org/obo/GO_0045972	negative regulation of juvenile hormone secretion	http://purl.obolibrary.org/obo/GO_0045443	juvenile hormone secretion
http://purl.obolibrary.org/obo/GO_0106427	negative regulation of kainate selective glutamate receptor signaling pathway	http://purl.obolibrary.org/obo/GO_0106426	regulation of kainate selective glutamate receptor signaling pathway
http://purl.obolibrary.org/obo/GO_1902173	negative regulation of keratinocyte apoptotic process	http://purl.obolibrary.org/obo/GO_0097283	keratinocyte apoptotic process
http://purl.obolibrary.org/obo/GO_0045617	negative regulation of keratinocyte differentiation	http://purl.obolibrary.org/obo/GO_0030216	keratinocyte differentiation
http://purl.obolibrary.org/obo/GO_0051548	negative regulation of keratinocyte migration	http://purl.obolibrary.org/obo/GO_0051546	keratinocyte migration
http://purl.obolibrary.org/obo/GO_0010839	negative regulation of keratinocyte proliferation	http://purl.obolibrary.org/obo/GO_0043616	keratinocyte proliferation
http://purl.obolibrary.org/obo/GO_0090185	negative regulation of kidney development	http://purl.obolibrary.org/obo/GO_0001822	kidney development
http://purl.obolibrary.org/obo/GO_2000357	negative regulation of kidney smooth muscle cell differentiation	http://purl.obolibrary.org/obo/GO_0072195	kidney smooth muscle cell differentiation
http://purl.obolibrary.org/obo/GO_0051711	negative regulation of killing of cells of another organism	http://purl.obolibrary.org/obo/GO_0031640	killing of cells of another organism
http://purl.obolibrary.org/obo/GO_0033673	negative regulation of kinase activity	http://purl.obolibrary.org/obo/GO_0016301	kinase activity
http://purl.obolibrary.org/obo/GO_1905560	negative regulation of kinetochore assembly	http://purl.obolibrary.org/obo/GO_0051382	kinetochore assembly
http://purl.obolibrary.org/obo/GO_0002257	negative regulation of kinin cascade	http://purl.obolibrary.org/obo/GO_0002254	kinin cascade
http://purl.obolibrary.org/obo/GO_1900395	negative regulation of kojic acid biosynthetic process	http://purl.obolibrary.org/obo/GO_2001317	kojic acid biosynthetic process
http://purl.obolibrary.org/obo/GO_1903488	negative regulation of lactation	http://purl.obolibrary.org/obo/GO_0007595	lactation
http://purl.obolibrary.org/obo/GO_1903535	negative regulation of lactose biosynthetic process	http://purl.obolibrary.org/obo/GO_0005989	lactose biosynthetic process
http://purl.obolibrary.org/obo/GO_0010593	negative regulation of lamellipodium assembly	http://purl.obolibrary.org/obo/GO_0030032	lamellipodium assembly
http://purl.obolibrary.org/obo/GO_2000393	negative regulation of lamellipodium morphogenesis	http://purl.obolibrary.org/obo/GO_0072673	lamellipodium morphogenesis
http://purl.obolibrary.org/obo/GO_1902744	negative regulation of lamellipodium organization	http://purl.obolibrary.org/obo/GO_0097581	lamellipodium organization
http://purl.obolibrary.org/obo/GO_0035204	negative regulation of lamellocyte differentiation	http://purl.obolibrary.org/obo/GO_0035171	lamellocyte differentiation
http://purl.obolibrary.org/obo/GO_1900304	negative regulation of laminaritriose transport	http://purl.obolibrary.org/obo/GO_2001097	laminaritriose transport
http://purl.obolibrary.org/obo/GO_1902607	negative regulation of large conductance calcium-activated potassium channel activity	http://purl.obolibrary.org/obo/GO_0060072	large conductance calcium-activated potassium channel activity
http://purl.obolibrary.org/obo/GO_0045710	negative regulation of larval salivary gland boundary specification	http://purl.obolibrary.org/obo/GO_0007433	larval salivary gland boundary specification
http://purl.obolibrary.org/obo/GO_0062230	negative regulation of larval somatic muscle development	http://purl.obolibrary.org/obo/GO_0007526	larval somatic muscle development
http://purl.obolibrary.org/obo/GO_1902823	negative regulation of late endosome to lysosome transport	http://purl.obolibrary.org/obo/GO_1902774	late endosome to lysosome transport
http://purl.obolibrary.org/obo/GO_0050949	negative regulation of late stripe melanocyte differentiation	http://purl.obolibrary.org/obo/GO_0050934	late stripe melanocyte differentiation
http://purl.obolibrary.org/obo/GO_0048375	negative regulation of lateral mesodermal cell fate determination	http://purl.obolibrary.org/obo/GO_0048373	lateral mesodermal cell fate determination
http://purl.obolibrary.org/obo/GO_0048380	negative regulation of lateral mesodermal cell fate specification	http://purl.obolibrary.org/obo/GO_0048377	lateral mesodermal cell fate specification
http://purl.obolibrary.org/obo/GO_1902077	negative regulation of lateral motor column neuron migration	http://purl.obolibrary.org/obo/GO_0097477	lateral motor column neuron migration
http://purl.obolibrary.org/obo/GO_1901332	negative regulation of lateral root development	http://purl.obolibrary.org/obo/GO_0048527	lateral root development
http://purl.obolibrary.org/obo/GO_1905622	negative regulation of leaf development	http://purl.obolibrary.org/obo/GO_0048366	leaf development
http://purl.obolibrary.org/obo/GO_1900056	negative regulation of leaf senescence	http://purl.obolibrary.org/obo/GO_0010150	leaf senescence
http://purl.obolibrary.org/obo/GO_2001110	negative regulation of lens epithelial cell proliferation	http://purl.obolibrary.org/obo/GO_0097166	lens epithelial cell proliferation
http://purl.obolibrary.org/obo/GO_1902747	negative regulation of lens fiber cell differentiation	http://purl.obolibrary.org/obo/GO_0070306	lens fiber cell differentiation
http://purl.obolibrary.org/obo/GO_2001277	negative regulation of leucine biosynthetic process	http://purl.obolibrary.org/obo/GO_0009098	leucine biosynthetic process
http://purl.obolibrary.org/obo/GO_0060358	negative regulation of leucine import	http://purl.obolibrary.org/obo/GO_1903801	L-leucine import across plasma membrane
http://purl.obolibrary.org/obo/GO_1905533	negative regulation of leucine import across plasma membrane	http://purl.obolibrary.org/obo/GO_0098713	leucine import across plasma membrane
http://purl.obolibrary.org/obo/GO_1903634	negative regulation of leucine-tRNA ligase activity	http://purl.obolibrary.org/obo/GO_0004823	leucine-tRNA ligase activity
http://purl.obolibrary.org/obo/GO_0048776	negative regulation of leucophore differentiation	http://purl.obolibrary.org/obo/GO_0048772	leucophore differentiation
http://purl.obolibrary.org/obo/GO_0002695	negative regulation of leukocyte activation	http://purl.obolibrary.org/obo/GO_0045321	leukocyte activation
http://purl.obolibrary.org/obo/GO_1904998	negative regulation of leukocyte adhesion to arterial endothelial cell	http://purl.obolibrary.org/obo/GO_0061757	leukocyte adhesion to arterial endothelial cell
http://purl.obolibrary.org/obo/GO_1904995	negative regulation of leukocyte adhesion to vascular endothelial cell	http://purl.obolibrary.org/obo/GO_0061756	leukocyte adhesion to vascular endothelial cell
http://purl.obolibrary.org/obo/GO_2000107	negative regulation of leukocyte apoptotic process	http://purl.obolibrary.org/obo/GO_0071887	leukocyte apoptotic process
http://purl.obolibrary.org/obo/GO_1903038	negative regulation of leukocyte cell-cell adhesion	http://purl.obolibrary.org/obo/GO_0007159	leukocyte cell-cell adhesion
http://purl.obolibrary.org/obo/GO_0002689	negative regulation of leukocyte chemotaxis	http://purl.obolibrary.org/obo/GO_0030595	leukocyte chemotaxis
http://purl.obolibrary.org/obo/GO_0043301	negative regulation of leukocyte degranulation	http://purl.obolibrary.org/obo/GO_0043299	leukocyte degranulation
http://purl.obolibrary.org/obo/GO_1902106	negative regulation of leukocyte differentiation	http://purl.obolibrary.org/obo/GO_0002521	leukocyte differentiation
http://purl.obolibrary.org/obo/GO_0001911	negative regulation of leukocyte mediated cytotoxicity	http://purl.obolibrary.org/obo/GO_0001909	leukocyte mediated cytotoxicity
http://purl.obolibrary.org/obo/GO_0002704	negative regulation of leukocyte mediated immunity	http://purl.obolibrary.org/obo/GO_0002443	leukocyte mediated immunity
http://purl.obolibrary.org/obo/GO_0002686	negative regulation of leukocyte migration	http://purl.obolibrary.org/obo/GO_0050900	leukocyte migration
http://purl.obolibrary.org/obo/GO_0070664	negative regulation of leukocyte proliferation	http://purl.obolibrary.org/obo/GO_0070661	leukocyte proliferation
http://purl.obolibrary.org/obo/GO_1903237	negative regulation of leukocyte tethering or rolling	http://purl.obolibrary.org/obo/GO_0050901	leukocyte tethering or rolling
http://purl.obolibrary.org/obo/GO_0035492	negative regulation of leukotriene production involved in inflammatory response	http://purl.obolibrary.org/obo/GO_0002540	leukotriene production involved in inflammatory response
http://purl.obolibrary.org/obo/GO_0051352	negative regulation of ligase activity	http://purl.obolibrary.org/obo/GO_0016874	ligase activity
http://purl.obolibrary.org/obo/GO_0045831	negative regulation of light-activated channel activity	http://purl.obolibrary.org/obo/GO_0010461	light-activated monoatomic ion channel activity
http://purl.obolibrary.org/obo/GO_0060192	negative regulation of lipase activity	http://purl.obolibrary.org/obo/GO_0016298	lipase activity
http://purl.obolibrary.org/obo/GO_1900131	negative regulation of lipid binding	http://purl.obolibrary.org/obo/GO_0008289	lipid binding
http://purl.obolibrary.org/obo/GO_0051055	negative regulation of lipid biosynthetic process	http://purl.obolibrary.org/obo/GO_0008610	lipid biosynthetic process
http://purl.obolibrary.org/obo/GO_0050995	negative regulation of lipid catabolic process	http://purl.obolibrary.org/obo/GO_0016042	lipid catabolic process
http://purl.obolibrary.org/obo/GO_0160078	negative regulation of lipid droplet fusion	http://purl.obolibrary.org/obo/GO_0160077	lipid droplet fusion
http://purl.obolibrary.org/obo/GO_0090219	negative regulation of lipid kinase activity	http://purl.obolibrary.org/obo/GO_0001727	lipid kinase activity
http://purl.obolibrary.org/obo/GO_1905953	negative regulation of lipid localization	http://purl.obolibrary.org/obo/GO_0010876	lipid localization
http://purl.obolibrary.org/obo/GO_0045833	negative regulation of lipid metabolic process	http://purl.obolibrary.org/obo/GO_0006629	lipid metabolic process
http://purl.obolibrary.org/obo/GO_0010888	negative regulation of lipid storage	http://purl.obolibrary.org/obo/GO_0019915	lipid storage
http://purl.obolibrary.org/obo/GO_0032369	negative regulation of lipid transport	http://purl.obolibrary.org/obo/GO_0006869	lipid transport
http://purl.obolibrary.org/obo/GO_1903001	negative regulation of lipid transport across blood-brain barrier	http://purl.obolibrary.org/obo/GO_1990379	lipid transport across blood-brain barrier
http://purl.obolibrary.org/obo/GO_0110114	negative regulation of lipid transporter activity	http://purl.obolibrary.org/obo/GO_0005319	lipid transporter activity
http://purl.obolibrary.org/obo/GO_1904503	negative regulation of lipophagy	http://purl.obolibrary.org/obo/GO_0061724	lipophagy
http://purl.obolibrary.org/obo/GO_0031665	negative regulation of lipopolysaccharide-mediated signaling pathway	http://purl.obolibrary.org/obo/GO_0031663	lipopolysaccharide-mediated signaling pathway
http://purl.obolibrary.org/obo/GO_0051005	negative regulation of lipoprotein lipase activity	http://purl.obolibrary.org/obo/GO_0004465	lipoprotein lipase activity
http://purl.obolibrary.org/obo/GO_0060588	negative regulation of lipoprotein lipid oxidation	http://purl.obolibrary.org/obo/GO_0034439	lipoprotein lipid oxidation
http://purl.obolibrary.org/obo/GO_0050748	negative regulation of lipoprotein metabolic process	http://purl.obolibrary.org/obo/GO_0042157	lipoprotein metabolic process
http://purl.obolibrary.org/obo/GO_0034443	negative regulation of lipoprotein oxidation	http://purl.obolibrary.org/obo/GO_0042161	lipoprotein oxidation
http://purl.obolibrary.org/obo/GO_0010985	negative regulation of lipoprotein particle clearance	http://purl.obolibrary.org/obo/GO_0034381	plasma lipoprotein particle clearance
http://purl.obolibrary.org/obo/GO_0140076	negative regulation of lipoprotein transport	http://purl.obolibrary.org/obo/GO_0042953	lipoprotein transport
http://purl.obolibrary.org/obo/GO_0140744	negative regulation of lncRNA transcription	http://purl.obolibrary.org/obo/GO_0140742	lncRNA transcription
http://purl.obolibrary.org/obo/GO_0040013	negative regulation of locomotion	http://purl.obolibrary.org/obo/GO_0040011	locomotion
http://purl.obolibrary.org/obo/GO_0090327	negative regulation of locomotion involved in locomotory behavior	http://purl.obolibrary.org/obo/GO_0031987	locomotion involved in locomotory behavior
http://purl.obolibrary.org/obo/GO_1904060	negative regulation of locomotor rhythm	http://purl.obolibrary.org/obo/GO_0045475	locomotor rhythm
http://purl.obolibrary.org/obo/GO_0010748	negative regulation of long-chain fatty acid import across plasma membrane	http://purl.obolibrary.org/obo/GO_0015911	long-chain fatty acid import across plasma membrane
http://purl.obolibrary.org/obo/GO_0140213	negative regulation of long-chain fatty acid import into cell	http://purl.obolibrary.org/obo/GO_0044539	long-chain fatty acid import into cell
http://purl.obolibrary.org/obo/GO_0048579	negative regulation of long-day photoperiodism, flowering	http://purl.obolibrary.org/obo/GO_0048574	long-day photoperiodism, flowering
http://purl.obolibrary.org/obo/GO_1900453	negative regulation of long-term synaptic depression	http://purl.obolibrary.org/obo/GO_0060292	long-term synaptic depression
http://purl.obolibrary.org/obo/GO_1900272	negative regulation of long-term synaptic potentiation	http://purl.obolibrary.org/obo/GO_0060291	long-term synaptic potentiation
http://purl.obolibrary.org/obo/GO_0010989	negative regulation of low-density lipoprotein particle clearance	http://purl.obolibrary.org/obo/GO_0034383	low-density lipoprotein particle clearance
http://purl.obolibrary.org/obo/GO_1905596	negative regulation of low-density lipoprotein particle receptor binding	http://purl.obolibrary.org/obo/GO_0050750	low-density lipoprotein particle receptor binding
http://purl.obolibrary.org/obo/GO_0032804	negative regulation of low-density lipoprotein particle receptor catabolic process	http://purl.obolibrary.org/obo/GO_0032802	low-density lipoprotein particle receptor catabolic process
http://purl.obolibrary.org/obo/GO_1905598	negative regulation of low-density lipoprotein receptor activity	http://purl.obolibrary.org/obo/GO_0005041	low-density lipoprotein particle receptor activity
http://purl.obolibrary.org/obo/GO_1904654	negative regulation of lung alveolus development	http://purl.obolibrary.org/obo/GO_0048286	lung alveolus development
http://purl.obolibrary.org/obo/GO_1901247	negative regulation of lung ciliated cell differentiation	http://purl.obolibrary.org/obo/GO_0061141	lung ciliated cell differentiation
http://purl.obolibrary.org/obo/GO_1901250	negative regulation of lung goblet cell differentiation	http://purl.obolibrary.org/obo/GO_0060480	lung goblet cell differentiation
http://purl.obolibrary.org/obo/GO_0033685	negative regulation of luteinizing hormone secretion	http://purl.obolibrary.org/obo/GO_0032275	luteinizing hormone secretion
http://purl.obolibrary.org/obo/GO_0051350	negative regulation of lyase activity	http://purl.obolibrary.org/obo/GO_0016829	lyase activity
http://purl.obolibrary.org/obo/GO_1901491	negative regulation of lymphangiogenesis	http://purl.obolibrary.org/obo/GO_0001946	lymphangiogenesis
http://purl.obolibrary.org/obo/GO_0051250	negative regulation of lymphocyte activation	http://purl.obolibrary.org/obo/GO_0046649	lymphocyte activation
http://purl.obolibrary.org/obo/GO_0002912	negative regulation of lymphocyte anergy	http://purl.obolibrary.org/obo/GO_0002249	lymphocyte anergy
http://purl.obolibrary.org/obo/GO_0070229	negative regulation of lymphocyte apoptotic process	http://purl.obolibrary.org/obo/GO_0070227	lymphocyte apoptotic process
http://purl.obolibrary.org/obo/GO_1901624	negative regulation of lymphocyte chemotaxis	http://purl.obolibrary.org/obo/GO_0048247	lymphocyte chemotaxis
http://purl.obolibrary.org/obo/GO_0045620	negative regulation of lymphocyte differentiation	http://purl.obolibrary.org/obo/GO_0030098	lymphocyte differentiation
http://purl.obolibrary.org/obo/GO_0002707	negative regulation of lymphocyte mediated immunity	http://purl.obolibrary.org/obo/GO_0002449	lymphocyte mediated immunity
http://purl.obolibrary.org/obo/GO_2000402	negative regulation of lymphocyte migration	http://purl.obolibrary.org/obo/GO_0072676	lymphocyte migration
http://purl.obolibrary.org/obo/GO_0050672	negative regulation of lymphocyte proliferation	http://purl.obolibrary.org/obo/GO_0046651	lymphocyte proliferation
http://purl.obolibrary.org/obo/GO_1905457	negative regulation of lymphoid progenitor cell differentiation	http://purl.obolibrary.org/obo/GO_0002320	lymphoid progenitor cell differentiation
