defined_class	defined_class_label	target1	target1_label	target2	target2_label
http://purl.obolibrary.org/obo/GO_0033083	regulation of immature T cell proliferation	http://purl.obolibrary.org/obo/GO_0008150	biological_process	http://purl.obolibrary.org/obo/GO_0033079	immature T cell proliferation
http://purl.obolibrary.org/obo/GO_0033084	regulation of immature T cell proliferation in thymus	http://purl.obolibrary.org/obo/GO_0008150	biological_process	http://purl.obolibrary.org/obo/GO_0033080	immature T cell proliferation in thymus
http://purl.obolibrary.org/obo/GO_0090264	regulation of immune complex clearance by monocytes and macrophages	http://purl.obolibrary.org/obo/GO_0008150	biological_process	http://purl.obolibrary.org/obo/GO_0002436	immune complex clearance by monocytes and macrophages
http://purl.obolibrary.org/obo/GO_0002697	regulation of immune effector process	http://purl.obolibrary.org/obo/GO_0008150	biological_process	http://purl.obolibrary.org/obo/GO_0002252	immune effector process
http://purl.obolibrary.org/obo/GO_0050776	regulation of immune response	http://purl.obolibrary.org/obo/GO_0008150	biological_process	http://purl.obolibrary.org/obo/GO_0006955	immune response
http://purl.obolibrary.org/obo/GO_0002837	regulation of immune response to tumor cell	http://purl.obolibrary.org/obo/GO_0008150	biological_process	http://purl.obolibrary.org/obo/GO_0002418	immune response to tumor cell
http://purl.obolibrary.org/obo/GO_0002682	regulation of immune system process	http://purl.obolibrary.org/obo/GO_0008150	biological_process	http://purl.obolibrary.org/obo/GO_0002376	immune system process
http://purl.obolibrary.org/obo/GO_0002640	regulation of immunoglobulin biosynthetic process	http://purl.obolibrary.org/obo/GO_0008150	biological_process	http://purl.obolibrary.org/obo/GO_0002378	immunoglobulin biosynthetic process
http://purl.obolibrary.org/obo/GO_0002889	regulation of immunoglobulin mediated immune response	http://purl.obolibrary.org/obo/GO_0008150	biological_process	http://purl.obolibrary.org/obo/GO_0016064	immunoglobulin mediated immune response
http://purl.obolibrary.org/obo/GO_0002637	regulation of immunoglobulin production	http://purl.obolibrary.org/obo/GO_0008150	biological_process	http://purl.obolibrary.org/obo/GO_0002377	immunoglobulin production
http://purl.obolibrary.org/obo/GO_0051023	regulation of immunoglobulin secretion	http://purl.obolibrary.org/obo/GO_0008150	biological_process	http://purl.obolibrary.org/obo/GO_0048305	immunoglobulin secretion
http://purl.obolibrary.org/obo/GO_2000520	regulation of immunological synapse formation	http://purl.obolibrary.org/obo/GO_0008150	biological_process	http://purl.obolibrary.org/obo/GO_0001771	immunological synapse formation
http://purl.obolibrary.org/obo/GO_0090083	regulation of inclusion body assembly	http://purl.obolibrary.org/obo/GO_0008150	biological_process	http://purl.obolibrary.org/obo/GO_0070841	inclusion body assembly
http://purl.obolibrary.org/obo/GO_1901996	regulation of indoleacetic acid biosynthetic process via tryptophan	http://purl.obolibrary.org/obo/GO_0008150	biological_process	http://purl.obolibrary.org/obo/GO_0009848	indoleacetic acid biosynthetic process via tryptophan
http://purl.obolibrary.org/obo/GO_0060905	regulation of induction of conjugation upon nitrogen starvation	http://purl.obolibrary.org/obo/GO_0008150	biological_process	http://purl.obolibrary.org/obo/GO_0031142	induction of conjugation upon nitrogen starvation
http://purl.obolibrary.org/obo/GO_0075184	regulation of infection cushion formation	http://purl.obolibrary.org/obo/GO_0065007	biological regulation	http://purl.obolibrary.org/obo/GO_0075183	infection cushion formation
http://purl.obolibrary.org/obo/GO_0050727	regulation of inflammatory response	http://purl.obolibrary.org/obo/GO_0008150	biological_process	http://purl.obolibrary.org/obo/GO_0006954	inflammatory response
http://purl.obolibrary.org/obo/GO_0002861	regulation of inflammatory response to antigenic stimulus	http://purl.obolibrary.org/obo/GO_0008150	biological_process	http://purl.obolibrary.org/obo/GO_0002437	inflammatory response to antigenic stimulus
http://purl.obolibrary.org/obo/GO_0106014	regulation of inflammatory response to wounding	http://purl.obolibrary.org/obo/GO_0008150	biological_process	http://purl.obolibrary.org/obo/GO_0090594	inflammatory response to wounding
http://purl.obolibrary.org/obo/GO_0010081	regulation of inflorescence meristem growth	http://purl.obolibrary.org/obo/GO_0008150	biological_process	http://purl.obolibrary.org/obo/GO_0010450	inflorescence meristem growth
http://purl.obolibrary.org/obo/GO_0032338	regulation of inhibin secretion	http://purl.obolibrary.org/obo/GO_0008150	biological_process	http://purl.obolibrary.org/obo/GO_0032334	inhibin secretion
http://purl.obolibrary.org/obo/GO_1904323	regulation of inhibitory G protein-coupled receptor phosphorylation	http://purl.obolibrary.org/obo/GO_0008150	biological_process	http://purl.obolibrary.org/obo/GO_0002030	inhibitory G protein-coupled receptor phosphorylation
http://purl.obolibrary.org/obo/GO_0045088	regulation of innate immune response	http://purl.obolibrary.org/obo/GO_0008150	biological_process	http://purl.obolibrary.org/obo/GO_0045087	innate immune response
http://purl.obolibrary.org/obo/GO_1905680	regulation of innate immunity memory response	http://purl.obolibrary.org/obo/GO_0008150	biological_process	http://purl.obolibrary.org/obo/GO_0090714	innate immunity memory response
http://purl.obolibrary.org/obo/GO_0045607	regulation of inner ear auditory receptor cell differentiation	http://purl.obolibrary.org/obo/GO_0008150	biological_process	http://purl.obolibrary.org/obo/GO_0042491	inner ear auditory receptor cell differentiation
http://purl.obolibrary.org/obo/GO_0042669	regulation of inner ear auditory receptor cell fate specification	http://purl.obolibrary.org/obo/GO_0008150	biological_process	http://purl.obolibrary.org/obo/GO_0042667	auditory receptor cell fate specification
http://purl.obolibrary.org/obo/GO_2000980	regulation of inner ear receptor cell differentiation	http://purl.obolibrary.org/obo/GO_0008150	biological_process	http://purl.obolibrary.org/obo/GO_0060113	inner ear receptor cell differentiation
http://purl.obolibrary.org/obo/GO_1900088	regulation of inositol biosynthetic process	http://purl.obolibrary.org/obo/GO_0008150	biological_process	http://purl.obolibrary.org/obo/GO_0006021	inositol biosynthetic process
http://purl.obolibrary.org/obo/GO_0046626	regulation of insulin receptor signaling pathway	http://purl.obolibrary.org/obo/GO_0008150	biological_process	http://purl.obolibrary.org/obo/GO_0008286	insulin receptor signaling pathway
http://purl.obolibrary.org/obo/GO_0050796	regulation of insulin secretion	http://purl.obolibrary.org/obo/GO_0008150	biological_process	http://purl.obolibrary.org/obo/GO_0030073	insulin secretion
http://purl.obolibrary.org/obo/GO_0043567	regulation of insulin-like growth factor receptor signaling pathway	http://purl.obolibrary.org/obo/GO_0008150	biological_process	http://purl.obolibrary.org/obo/GO_0048009	insulin-like growth factor receptor signaling pathway
http://purl.obolibrary.org/obo/GO_0045113	regulation of integrin biosynthetic process	http://purl.obolibrary.org/obo/GO_0008150	biological_process	http://purl.obolibrary.org/obo/GO_0045112	integrin biosynthetic process
http://purl.obolibrary.org/obo/GO_2001044	regulation of integrin-mediated signaling pathway	http://purl.obolibrary.org/obo/GO_0008150	biological_process	http://purl.obolibrary.org/obo/GO_0007229	integrin-mediated signaling pathway
http://purl.obolibrary.org/obo/GO_0032647	regulation of interferon-alpha production	http://purl.obolibrary.org/obo/GO_0008150	biological_process	http://purl.obolibrary.org/obo/GO_0032607	interferon-alpha production
http://purl.obolibrary.org/obo/GO_0032648	regulation of interferon-beta production	http://purl.obolibrary.org/obo/GO_0008150	biological_process	http://purl.obolibrary.org/obo/GO_0032608	interferon-beta production
http://purl.obolibrary.org/obo/GO_0032649	regulation of interferon-gamma production	http://purl.obolibrary.org/obo/GO_0008150	biological_process	http://purl.obolibrary.org/obo/GO_0032609	interferon-gamma production
http://purl.obolibrary.org/obo/GO_0060334	regulation of interferon-gamma-mediated signaling pathway	http://purl.obolibrary.org/obo/GO_0008150	biological_process	http://purl.obolibrary.org/obo/GO_0060333	interferon-gamma-mediated signaling pathway
http://purl.obolibrary.org/obo/GO_0032650	regulation of interleukin-1 alpha production	http://purl.obolibrary.org/obo/GO_0008150	biological_process	http://purl.obolibrary.org/obo/GO_0032610	interleukin-1 alpha production
http://purl.obolibrary.org/obo/GO_0032651	regulation of interleukin-1 beta production	http://purl.obolibrary.org/obo/GO_0008150	biological_process	http://purl.obolibrary.org/obo/GO_0032611	interleukin-1 beta production
http://purl.obolibrary.org/obo/GO_0032652	regulation of interleukin-1 production	http://purl.obolibrary.org/obo/GO_0008150	biological_process	http://purl.obolibrary.org/obo/GO_0032612	interleukin-1 production
http://purl.obolibrary.org/obo/GO_2000659	regulation of interleukin-1-mediated signaling pathway	http://purl.obolibrary.org/obo/GO_0008150	biological_process	http://purl.obolibrary.org/obo/GO_0070498	interleukin-1-mediated signaling pathway
http://purl.obolibrary.org/obo/GO_0032653	regulation of interleukin-10 production	http://purl.obolibrary.org/obo/GO_0008150	biological_process	http://purl.obolibrary.org/obo/GO_0032613	interleukin-10 production
http://purl.obolibrary.org/obo/GO_0032654	regulation of interleukin-11 production	http://purl.obolibrary.org/obo/GO_0008150	biological_process	http://purl.obolibrary.org/obo/GO_0032614	interleukin-11 production
http://purl.obolibrary.org/obo/GO_0032655	regulation of interleukin-12 production	http://purl.obolibrary.org/obo/GO_0008150	biological_process	http://purl.obolibrary.org/obo/GO_0032615	interleukin-12 production
http://purl.obolibrary.org/obo/GO_0032656	regulation of interleukin-13 production	http://purl.obolibrary.org/obo/GO_0008150	biological_process	http://purl.obolibrary.org/obo/GO_0032616	interleukin-13 production
http://purl.obolibrary.org/obo/GO_0032657	regulation of interleukin-14 production	http://purl.obolibrary.org/obo/GO_0008150	biological_process	http://purl.obolibrary.org/obo/GO_0032617	interleukin-14 production
http://purl.obolibrary.org/obo/GO_0032658	regulation of interleukin-15 production	http://purl.obolibrary.org/obo/GO_0008150	biological_process	http://purl.obolibrary.org/obo/GO_0032618	interleukin-15 production
http://purl.obolibrary.org/obo/GO_0032659	regulation of interleukin-16 production	http://purl.obolibrary.org/obo/GO_0008150	biological_process	http://purl.obolibrary.org/obo/GO_0032619	interleukin-16 production
http://purl.obolibrary.org/obo/GO_0032660	regulation of interleukin-17 production	http://purl.obolibrary.org/obo/GO_0008150	biological_process	http://purl.obolibrary.org/obo/GO_0032620	interleukin-17 production
http://purl.obolibrary.org/obo/GO_1903881	regulation of interleukin-17-mediated signaling pathway	http://purl.obolibrary.org/obo/GO_0008150	biological_process	http://purl.obolibrary.org/obo/GO_0097400	interleukin-17-mediated signaling pathway
http://purl.obolibrary.org/obo/GO_0150151	regulation of interleukin-17A production	http://purl.obolibrary.org/obo/GO_0065007	biological regulation	http://purl.obolibrary.org/obo/GO_0097087	interleukin-17A production
http://purl.obolibrary.org/obo/GO_0032661	regulation of interleukin-18 production	http://purl.obolibrary.org/obo/GO_0008150	biological_process	http://purl.obolibrary.org/obo/GO_0032621	interleukin-18 production
http://purl.obolibrary.org/obo/GO_2000492	regulation of interleukin-18-mediated signaling pathway	http://purl.obolibrary.org/obo/GO_0008150	biological_process	http://purl.obolibrary.org/obo/GO_0035655	interleukin-18-mediated signaling pathway
http://purl.obolibrary.org/obo/GO_0032662	regulation of interleukin-19 production	http://purl.obolibrary.org/obo/GO_0008150	biological_process	http://purl.obolibrary.org/obo/GO_0032622	interleukin-19 production
http://purl.obolibrary.org/obo/GO_0032663	regulation of interleukin-2 production	http://purl.obolibrary.org/obo/GO_0008150	biological_process	http://purl.obolibrary.org/obo/GO_0032623	interleukin-2 production
http://purl.obolibrary.org/obo/GO_1902205	regulation of interleukin-2-mediated signaling pathway	http://purl.obolibrary.org/obo/GO_0008150	biological_process	http://purl.obolibrary.org/obo/GO_0038110	interleukin-2-mediated signaling pathway
http://purl.obolibrary.org/obo/GO_0032664	regulation of interleukin-20 production	http://purl.obolibrary.org/obo/GO_0008150	biological_process	http://purl.obolibrary.org/obo/GO_0032624	interleukin-20 production
http://purl.obolibrary.org/obo/GO_0032665	regulation of interleukin-21 production	http://purl.obolibrary.org/obo/GO_0008150	biological_process	http://purl.obolibrary.org/obo/GO_0032625	interleukin-21 production
http://purl.obolibrary.org/obo/GO_0032666	regulation of interleukin-22 production	http://purl.obolibrary.org/obo/GO_0008150	biological_process	http://purl.obolibrary.org/obo/GO_0032626	interleukin-22 production
http://purl.obolibrary.org/obo/GO_0032667	regulation of interleukin-23 production	http://purl.obolibrary.org/obo/GO_0008150	biological_process	http://purl.obolibrary.org/obo/GO_0032627	interleukin-23 production
http://purl.obolibrary.org/obo/GO_0032668	regulation of interleukin-24 production	http://purl.obolibrary.org/obo/GO_0008150	biological_process	http://purl.obolibrary.org/obo/GO_0032628	interleukin-24 production
http://purl.obolibrary.org/obo/GO_0032669	regulation of interleukin-25 production	http://purl.obolibrary.org/obo/GO_0008150	biological_process	http://purl.obolibrary.org/obo/GO_0032629	interleukin-25 production
http://purl.obolibrary.org/obo/GO_0032670	regulation of interleukin-26 production	http://purl.obolibrary.org/obo/GO_0008150	biological_process	http://purl.obolibrary.org/obo/GO_0032630	interleukin-26 production
http://purl.obolibrary.org/obo/GO_0032671	regulation of interleukin-27 production	http://purl.obolibrary.org/obo/GO_0008150	biological_process	http://purl.obolibrary.org/obo/GO_0032631	interleukin-27 production
http://purl.obolibrary.org/obo/GO_0070107	regulation of interleukin-27-mediated signaling pathway	http://purl.obolibrary.org/obo/GO_0008150	biological_process	http://purl.obolibrary.org/obo/GO_0070106	interleukin-27-mediated signaling pathway
http://purl.obolibrary.org/obo/GO_0032672	regulation of interleukin-3 production	http://purl.obolibrary.org/obo/GO_0008150	biological_process	http://purl.obolibrary.org/obo/GO_0032632	interleukin-3 production
http://purl.obolibrary.org/obo/GO_0150189	regulation of interleukin-32 production	http://purl.obolibrary.org/obo/GO_0065007	biological regulation	http://purl.obolibrary.org/obo/GO_0072637	interleukin-32 production
http://purl.obolibrary.org/obo/GO_0150127	regulation of interleukin-33 production	http://purl.obolibrary.org/obo/GO_0065007	biological regulation	http://purl.obolibrary.org/obo/GO_0072639	interleukin-33 production
http://purl.obolibrary.org/obo/GO_0150157	regulation of interleukin-34 production	http://purl.obolibrary.org/obo/GO_0065007	biological regulation	http://purl.obolibrary.org/obo/GO_0150155	interleukin-34 production
http://purl.obolibrary.org/obo/GO_0070754	regulation of interleukin-35 production	http://purl.obolibrary.org/obo/GO_0008150	biological_process	http://purl.obolibrary.org/obo/GO_0070753	interleukin-35 production
http://purl.obolibrary.org/obo/GO_0070758	regulation of interleukin-35-mediated signaling pathway	http://purl.obolibrary.org/obo/GO_0008150	biological_process	http://purl.obolibrary.org/obo/GO_0070757	interleukin-35-mediated signaling pathway
http://purl.obolibrary.org/obo/GO_0150136	regulation of interleukin-37 production	http://purl.obolibrary.org/obo/GO_0065007	biological regulation	http://purl.obolibrary.org/obo/GO_0150137	interleukin-37 production
http://purl.obolibrary.org/obo/GO_0032673	regulation of interleukin-4 production	http://purl.obolibrary.org/obo/GO_0008150	biological_process	http://purl.obolibrary.org/obo/GO_0032633	interleukin-4 production
http://purl.obolibrary.org/obo/GO_2000571	regulation of interleukin-4-dependent isotype switching to IgE isotypes	http://purl.obolibrary.org/obo/GO_0008150	biological_process	http://purl.obolibrary.org/obo/GO_0035708	interleukin-4-dependent isotype switching to IgE isotypes
http://purl.obolibrary.org/obo/GO_1902214	regulation of interleukin-4-mediated signaling pathway	http://purl.obolibrary.org/obo/GO_0008150	biological_process	http://purl.obolibrary.org/obo/GO_0035771	interleukin-4-mediated signaling pathway
http://purl.obolibrary.org/obo/GO_0032674	regulation of interleukin-5 production	http://purl.obolibrary.org/obo/GO_0008150	biological_process	http://purl.obolibrary.org/obo/GO_0032634	interleukin-5 production
http://purl.obolibrary.org/obo/GO_0032675	regulation of interleukin-6 production	http://purl.obolibrary.org/obo/GO_0008150	biological_process	http://purl.obolibrary.org/obo/GO_0032635	interleukin-6 production
http://purl.obolibrary.org/obo/GO_0070103	regulation of interleukin-6-mediated signaling pathway	http://purl.obolibrary.org/obo/GO_0008150	biological_process	http://purl.obolibrary.org/obo/GO_0070102	interleukin-6-mediated signaling pathway
http://purl.obolibrary.org/obo/GO_0032676	regulation of interleukin-7 production	http://purl.obolibrary.org/obo/GO_0008150	biological_process	http://purl.obolibrary.org/obo/GO_0032636	interleukin-7 production
http://purl.obolibrary.org/obo/GO_0032677	regulation of interleukin-8 production	http://purl.obolibrary.org/obo/GO_0008150	biological_process	http://purl.obolibrary.org/obo/GO_0032637	interleukin-8 production
http://purl.obolibrary.org/obo/GO_0032678	regulation of interleukin-9 production	http://purl.obolibrary.org/obo/GO_0008150	biological_process	http://purl.obolibrary.org/obo/GO_0032638	interleukin-9 production
http://purl.obolibrary.org/obo/GO_0048395	regulation of intermediate mesodermal cell fate determination	http://purl.obolibrary.org/obo/GO_0008150	biological_process	http://purl.obolibrary.org/obo/GO_0048394	intermediate mesodermal cell fate determination
http://purl.obolibrary.org/obo/GO_0048399	regulation of intermediate mesodermal cell fate specification	http://purl.obolibrary.org/obo/GO_0008150	biological_process	http://purl.obolibrary.org/obo/GO_0048398	intermediate mesodermal cell fate specification
http://purl.obolibrary.org/obo/GO_1904478	regulation of intestinal absorption	http://purl.obolibrary.org/obo/GO_0008150	biological_process	http://purl.obolibrary.org/obo/GO_0050892	intestinal absorption
http://purl.obolibrary.org/obo/GO_1905298	regulation of intestinal epithelial cell development	http://purl.obolibrary.org/obo/GO_0008150	biological_process	http://purl.obolibrary.org/obo/GO_0060576	intestinal epithelial cell development
http://purl.obolibrary.org/obo/GO_0060730	regulation of intestinal epithelial structure maintenance	http://purl.obolibrary.org/obo/GO_0008150	biological_process	http://purl.obolibrary.org/obo/GO_0060729	intestinal epithelial structure maintenance
http://purl.obolibrary.org/obo/GO_0033146	regulation of intracellular estrogen receptor signaling pathway	http://purl.obolibrary.org/obo/GO_0008150	biological_process	http://purl.obolibrary.org/obo/GO_0030520	intracellular estrogen receptor signaling pathway
http://purl.obolibrary.org/obo/GO_1904580	regulation of intracellular mRNA localization	http://purl.obolibrary.org/obo/GO_0008150	biological_process	http://purl.obolibrary.org/obo/GO_0008298	intracellular mRNA localization
http://purl.obolibrary.org/obo/GO_0033143	regulation of intracellular steroid hormone receptor signaling pathway	http://purl.obolibrary.org/obo/GO_0008150	biological_process	http://purl.obolibrary.org/obo/GO_0030518	intracellular steroid hormone receptor signaling pathway
http://purl.obolibrary.org/obo/GO_0032386	regulation of intracellular transport	http://purl.obolibrary.org/obo/GO_0008150	biological_process	http://purl.obolibrary.org/obo/GO_0046907	intracellular transport
http://purl.obolibrary.org/obo/GO_1905796	regulation of intraciliary anterograde transport	http://purl.obolibrary.org/obo/GO_0008150	biological_process	http://purl.obolibrary.org/obo/GO_0035720	intraciliary anterograde transport
http://purl.obolibrary.org/obo/GO_1905799	regulation of intraciliary retrograde transport	http://purl.obolibrary.org/obo/GO_0008150	biological_process	http://purl.obolibrary.org/obo/GO_0035721	intraciliary retrograde transport
http://purl.obolibrary.org/obo/GO_1905365	regulation of intralumenal vesicle formation	http://purl.obolibrary.org/obo/GO_0008150	biological_process	http://purl.obolibrary.org/obo/GO_0070676	intralumenal vesicle formation
http://purl.obolibrary.org/obo/GO_2001242	regulation of intrinsic apoptotic signaling pathway	http://purl.obolibrary.org/obo/GO_0008150	biological_process	http://purl.obolibrary.org/obo/GO_0097193	intrinsic apoptotic signaling pathway
http://purl.obolibrary.org/obo/GO_1902253	regulation of intrinsic apoptotic signaling pathway by p53 class mediator	http://purl.obolibrary.org/obo/GO_0008150	biological_process	http://purl.obolibrary.org/obo/GO_0072332	intrinsic apoptotic signaling pathway by p53 class mediator
http://purl.obolibrary.org/obo/GO_1902229	regulation of intrinsic apoptotic signaling pathway in response to DNA damage	http://purl.obolibrary.org/obo/GO_0008150	biological_process	http://purl.obolibrary.org/obo/GO_0008630	intrinsic apoptotic signaling pathway in response to DNA damage
http://purl.obolibrary.org/obo/GO_1902165	regulation of intrinsic apoptotic signaling pathway in response to DNA damage by p53 class mediator	http://purl.obolibrary.org/obo/GO_0008150	biological_process	http://purl.obolibrary.org/obo/GO_0042771	intrinsic apoptotic signaling pathway in response to DNA damage by p53 class mediator
http://purl.obolibrary.org/obo/GO_1903750	regulation of intrinsic apoptotic signaling pathway in response to hydrogen peroxide	http://purl.obolibrary.org/obo/GO_0008150	biological_process	http://purl.obolibrary.org/obo/GO_0036481	intrinsic apoptotic signaling pathway in response to hydrogen peroxide
http://purl.obolibrary.org/obo/GO_1902218	regulation of intrinsic apoptotic signaling pathway in response to osmotic stress	http://purl.obolibrary.org/obo/GO_0008150	biological_process	http://purl.obolibrary.org/obo/GO_0008627	intrinsic apoptotic signaling pathway in response to osmotic stress
http://purl.obolibrary.org/obo/GO_1902238	regulation of intrinsic apoptotic signaling pathway in response to osmotic stress by p53 class mediator	http://purl.obolibrary.org/obo/GO_0008150	biological_process	http://purl.obolibrary.org/obo/GO_1990127	intrinsic apoptotic signaling pathway in response to osmotic stress by p53 class mediator
http://purl.obolibrary.org/obo/GO_2000217	regulation of invasive growth in response to glucose limitation	http://purl.obolibrary.org/obo/GO_0008150	biological_process	http://purl.obolibrary.org/obo/GO_0001403	invasive growth in response to glucose limitation
http://purl.obolibrary.org/obo/GO_0050937	regulation of iridophore differentiation	http://purl.obolibrary.org/obo/GO_0008150	biological_process	http://purl.obolibrary.org/obo/GO_0050935	iridophore differentiation
http://purl.obolibrary.org/obo/GO_1903329	regulation of iron-sulfur cluster assembly	http://purl.obolibrary.org/obo/GO_0008150	biological_process	http://purl.obolibrary.org/obo/GO_0016226	iron-sulfur cluster assembly
http://purl.obolibrary.org/obo/GO_1900506	regulation of iron-sulfur-molybdenum cofactor assembly	http://purl.obolibrary.org/obo/GO_0008150	biological_process	http://purl.obolibrary.org/obo/GO_0044593	iron-sulfur-molybdenum cofactor assembly
http://purl.obolibrary.org/obo/GO_0019747	regulation of isoprenoid metabolic process	http://purl.obolibrary.org/obo/GO_0008150	biological_process	http://purl.obolibrary.org/obo/GO_0006720	isoprenoid metabolic process
http://purl.obolibrary.org/obo/GO_0045191	regulation of isotype switching	http://purl.obolibrary.org/obo/GO_0008150	biological_process	http://purl.obolibrary.org/obo/GO_0045190	isotype switching
http://purl.obolibrary.org/obo/GO_0048296	regulation of isotype switching to IgA isotypes	http://purl.obolibrary.org/obo/GO_0008150	biological_process	http://purl.obolibrary.org/obo/GO_0048290	isotype switching to IgA isotypes
http://purl.obolibrary.org/obo/GO_0048299	regulation of isotype switching to IgD isotypes	http://purl.obolibrary.org/obo/GO_0008150	biological_process	http://purl.obolibrary.org/obo/GO_0048292	isotype switching to IgD isotypes
http://purl.obolibrary.org/obo/GO_0048293	regulation of isotype switching to IgE isotypes	http://purl.obolibrary.org/obo/GO_0008150	biological_process	http://purl.obolibrary.org/obo/GO_0048289	isotype switching to IgE isotypes
http://purl.obolibrary.org/obo/GO_0048302	regulation of isotype switching to IgG isotypes	http://purl.obolibrary.org/obo/GO_0008150	biological_process	http://purl.obolibrary.org/obo/GO_0048291	isotype switching to IgG isotypes
http://purl.obolibrary.org/obo/GO_2000022	regulation of jasmonic acid mediated signaling pathway	http://purl.obolibrary.org/obo/GO_0008150	biological_process	http://purl.obolibrary.org/obo/GO_0009867	jasmonic acid mediated signaling pathway
http://purl.obolibrary.org/obo/GO_0007557	regulation of juvenile hormone biosynthetic process	http://purl.obolibrary.org/obo/GO_0008150	biological_process	http://purl.obolibrary.org/obo/GO_0006718	juvenile hormone biosynthetic process
