?defined_class	?defined_class_label	?biological_regulation	?biological_regulation_label	?entity	?entity_label
<http://purl.obolibrary.org/obo/GO_0051881>	"regulation of mitochondrial membrane potential"	<http://purl.obolibrary.org/obo/GO_0065007>	"biological regulation"	<http://purl.obolibrary.org/obo/OBA_0000105>	"mitochondrial membrane potential"
<http://purl.obolibrary.org/obo/GO_0044529>	"regulation of mitochondrial rRNA stability"	<http://purl.obolibrary.org/obo/GO_0065007>	"biological regulation"	<http://purl.obolibrary.org/obo/OBA_0000106>	"mitochondrial rRNA stability"
<http://purl.obolibrary.org/obo/GO_0010796>	"regulation of multivesicular body size"	<http://purl.obolibrary.org/obo/GO_0065007>	"biological regulation"	<http://purl.obolibrary.org/obo/OBA_0000107>	"multivesicular body size"
<http://purl.obolibrary.org/obo/GO_0032972>	"regulation of muscle filament sliding speed"	<http://purl.obolibrary.org/obo/GO_0065007>	"biological regulation"	<http://purl.obolibrary.org/obo/OBA_0000110>	"muscle filament sliding speed"
<http://purl.obolibrary.org/obo/GO_0014882>	"regulation of myofibril number"	<http://purl.obolibrary.org/obo/GO_0065007>	"biological regulation"	<http://purl.obolibrary.org/obo/OBA_0000112>	"myofibril number"
<http://purl.obolibrary.org/obo/GO_0014881>	"regulation of myofibril size"	<http://purl.obolibrary.org/obo/GO_0065007>	"biological regulation"	<http://purl.obolibrary.org/obo/OBA_0000113>	"myofibril size"
<http://purl.obolibrary.org/obo/GO_0098908>	"regulation of neuronal action potential"	<http://purl.obolibrary.org/obo/GO_0050789>	"regulation of biological process"	<http://purl.obolibrary.org/obo/GO_0019228>	"neuronal action potential"
<http://purl.obolibrary.org/obo/GO_0048168>	"regulation of neuronal synaptic plasticity"	<http://purl.obolibrary.org/obo/GO_0065007>	"biological regulation"	<http://purl.obolibrary.org/obo/OBA_0000114>	"neuronal synaptic plasticity"
<http://purl.obolibrary.org/obo/GO_0001505>	"regulation of neurotransmitter levels"	<http://purl.obolibrary.org/obo/GO_0065007>	"biological regulation"	<http://purl.obolibrary.org/obo/OBA_0000116>	"neurotransmitter levels"
<http://purl.obolibrary.org/obo/GO_0060303>	"regulation of nucleosome density"	<http://purl.obolibrary.org/obo/GO_0065007>	"biological regulation"	<http://purl.obolibrary.org/obo/OBA_0000119>	"nucleosome density"
<http://purl.obolibrary.org/obo/GO_0097298>	"regulation of nucleus size"	<http://purl.obolibrary.org/obo/GO_0065007>	"biological regulation"	<http://purl.obolibrary.org/obo/OBA_0000117>	"nuclear size"
<http://purl.obolibrary.org/obo/GO_0006885>	"regulation of pH"	<http://purl.obolibrary.org/obo/GO_0065007>	"biological regulation"	<http://purl.obolibrary.org/obo/OBA_0000121>	"pH"
<http://purl.obolibrary.org/obo/GO_0044375>	"regulation of peroxisome size"	<http://purl.obolibrary.org/obo/GO_0065007>	"biological regulation"	<http://purl.obolibrary.org/obo/OBA_0000122>	"peroxisome size"
<http://purl.obolibrary.org/obo/GO_1900545>	"regulation of phenotypic switching by regulation of transcription from RNA polymerase II promoter"	<http://purl.obolibrary.org/obo/GO_0050789>	"regulation of biological process"	<http://purl.obolibrary.org/obo/GO_0100057>	"regulation of phenotypic switching by transcription from RNA polymerase II promoter"
<http://purl.obolibrary.org/obo/GO_0097036>	"regulation of plasma membrane sterol distribution"	<http://purl.obolibrary.org/obo/GO_0065007>	"biological regulation"	<http://purl.obolibrary.org/obo/OBA_0000123>	"plasma membrane sterol distribution"
<http://purl.obolibrary.org/obo/GO_0044656>	"regulation of post-lysosomal vacuole size"	<http://purl.obolibrary.org/obo/GO_0065007>	"biological regulation"	<http://purl.obolibrary.org/obo/OBA_0000124>	"post-lysosomal vacuole size"
<http://purl.obolibrary.org/obo/GO_0098962>	"regulation of postsynaptic neurotransmitter receptor activity"	<http://purl.obolibrary.org/obo/GO_0065009>	"regulation of molecular function"	<http://purl.obolibrary.org/obo/GO_0098960>	"postsynaptic neurotransmitter receptor activity"
<http://purl.obolibrary.org/obo/GO_0035565>	"regulation of pronephros size"	<http://purl.obolibrary.org/obo/GO_0065007>	"biological regulation"	<http://purl.obolibrary.org/obo/OBA_0000127>	"pronephric kidney size"
<http://purl.obolibrary.org/obo/GO_0031647>	"regulation of protein stability"	<http://purl.obolibrary.org/obo/GO_0065007>	"biological regulation"	<http://purl.obolibrary.org/obo/OBA_0000128>	"protein stability"
<http://purl.obolibrary.org/obo/GO_1900448>	"regulation of pyrimidine nucleotide biosynthetic process by positive regulation of transcription from RNA polymerase II promoter"	<http://purl.obolibrary.org/obo/GO_0050789>	"regulation of biological process"	<http://purl.obolibrary.org/obo/GO_0100039>	"regulation of pyrimidine nucleotide biosynthetic process by transcription from RNA polymerase II promoter"
<http://purl.obolibrary.org/obo/GO_0044357>	"regulation of rRNA stability"	<http://purl.obolibrary.org/obo/GO_0065007>	"biological regulation"	<http://purl.obolibrary.org/obo/OBA_0000129>	"rRNA stability"
<http://purl.obolibrary.org/obo/GO_1905945>	"regulation of response to calcium ion"	<http://purl.obolibrary.org/obo/GO_0065007>	"biological regulation"	<http://purl.obolibrary.org/obo/GO_0051592>	"response to calcium ion"
<http://purl.obolibrary.org/obo/GO_0060075>	"regulation of resting membrane potential"	<http://purl.obolibrary.org/obo/GO_0065007>	"biological regulation"	<http://purl.obolibrary.org/obo/OBA_0000134>	"resting membrane potential"
<http://purl.obolibrary.org/obo/GO_0048172>	"regulation of short-term neuronal synaptic plasticity"	<http://purl.obolibrary.org/obo/GO_0065007>	"biological regulation"	<http://purl.obolibrary.org/obo/OBA_0000136>	"short-term neuronal synaptic plasticity"
<http://purl.obolibrary.org/obo/GO_0100001>	"regulation of skeletal muscle contraction by action potential"	<http://purl.obolibrary.org/obo/GO_0001508>	"action potential"	<http://purl.obolibrary.org/obo/GO_0003009>	"skeletal muscle contraction"
<http://purl.obolibrary.org/obo/GO_0014722>	"regulation of skeletal muscle contraction by calcium ion signaling"	<http://purl.obolibrary.org/obo/GO_0019722>	"calcium-mediated signaling"	<http://purl.obolibrary.org/obo/GO_0003009>	"skeletal muscle contraction"
<http://purl.obolibrary.org/obo/GO_0014861>	"regulation of skeletal muscle contraction via regulation of action potential"	<http://purl.obolibrary.org/obo/GO_0050789>	"regulation of biological process"	<http://purl.obolibrary.org/obo/GO_0100001>	"regulation of skeletal muscle contraction by action potential"
<http://purl.obolibrary.org/obo/GO_0090225>	"regulation of spindle density"	<http://purl.obolibrary.org/obo/GO_0065007>	"biological regulation"	<http://purl.obolibrary.org/obo/OBA_0000138>	"spindle density"
<http://purl.obolibrary.org/obo/GO_0050803>	"regulation of synapse structure or activity"	<http://purl.obolibrary.org/obo/GO_0065007>	"biological regulation"	<http://purl.obolibrary.org/obo/OBA_0000139>	"synapse structure and activity"
<http://purl.obolibrary.org/obo/GO_0031916>	"regulation of synaptic metaplasticity"	<http://purl.obolibrary.org/obo/GO_0065007>	"biological regulation"	<http://purl.obolibrary.org/obo/OBA_0000140>	"synaptic metaplasticity"
<http://purl.obolibrary.org/obo/GO_0048167>	"regulation of synaptic plasticity"	<http://purl.obolibrary.org/obo/GO_0065007>	"biological regulation"	<http://purl.obolibrary.org/obo/OBA_0000141>	"synaptic plasticity"
<http://purl.obolibrary.org/obo/GO_0003073>	"regulation of systemic arterial blood pressure"	<http://purl.obolibrary.org/obo/GO_0065007>	"biological regulation"	<http://purl.obolibrary.org/obo/OBA_0000143>	"systemic arterial blood pressure"
<http://purl.obolibrary.org/obo/GO_0090067>	"regulation of thalamus size"	<http://purl.obolibrary.org/obo/GO_0065007>	"biological regulation"	<http://purl.obolibrary.org/obo/OBA_0000160>	"thalamus size"
<http://purl.obolibrary.org/obo/GO_0002026>	"regulation of the force of heart contraction"	<http://purl.obolibrary.org/obo/GO_0065007>	"biological regulation"	<http://purl.obolibrary.org/obo/OBA_0000161>	"force of heart contraction"
<http://purl.obolibrary.org/obo/GO_0014729>	"regulation of the velocity of shortening of skeletal muscle modulating contraction"	<http://purl.obolibrary.org/obo/GO_0065007>	"biological regulation"	<http://purl.obolibrary.org/obo/OBA_0000164>	"velocity of shortening of skeletal muscle modulating contraction"
<http://purl.obolibrary.org/obo/GO_1900382>	"regulation of thiamine biosynthetic process by regulation of transcription from RNA polymerase II promoter"	<http://purl.obolibrary.org/obo/GO_0050789>	"regulation of biological process"	<http://purl.obolibrary.org/obo/GO_0100016>	"regulation of thiamine biosynthetic process by transcription from RNA polymerase II promoter"
<http://purl.obolibrary.org/obo/GO_1900621>	"regulation of transcription from RNA polymerase II promoter by calcium-mediated signaling"	<http://purl.obolibrary.org/obo/GO_0019722>	"calcium-mediated signaling"	<http://purl.obolibrary.org/obo/GO_0006366>	"transcription from RNA polymerase II promoter"
<http://purl.obolibrary.org/obo/GO_0006450>	"regulation of translational fidelity"	<http://purl.obolibrary.org/obo/GO_0065007>	"biological regulation"	<http://purl.obolibrary.org/obo/OBA_0000169>	"translational accuracy"
<http://purl.obolibrary.org/obo/GO_0035296>	"regulation of tube diameter"	<http://purl.obolibrary.org/obo/GO_0065007>	"biological regulation"	<http://purl.obolibrary.org/obo/OBA_0000171>	"tube diameter"
<http://purl.obolibrary.org/obo/GO_0035158>	"regulation of tube diameter, open tracheal system"	<http://purl.obolibrary.org/obo/GO_0065007>	"biological regulation"	<http://purl.obolibrary.org/obo/OBA_0000166>	"tracheal tube diameter"
<http://purl.obolibrary.org/obo/GO_0035159>	"regulation of tube length, open tracheal system"	<http://purl.obolibrary.org/obo/GO_0065007>	"biological regulation"	<http://purl.obolibrary.org/obo/OBA_0000167>	"tracheal tube length"
<http://purl.obolibrary.org/obo/GO_0035150>	"regulation of tube size"	<http://purl.obolibrary.org/obo/GO_0065007>	"biological regulation"	<http://purl.obolibrary.org/obo/OBA_0000172>	"tube size"
<http://purl.obolibrary.org/obo/GO_0035809>	"regulation of urine volume"	<http://purl.obolibrary.org/obo/GO_0065007>	"biological regulation"	<http://purl.obolibrary.org/obo/OBA_0000173>	"urinary volume"
<http://purl.obolibrary.org/obo/GO_0043114>	"regulation of vascular permeability"	<http://purl.obolibrary.org/obo/GO_0065007>	"biological regulation"	<http://purl.obolibrary.org/obo/OBA_0000174>	"vascular permeability"
<http://purl.obolibrary.org/obo/GO_1905930>	"regulation of vascular smooth muscle cell differentiation involved in phenotypic switching"	<http://purl.obolibrary.org/obo/GO_0065007>	"biological regulation"	<http://purl.obolibrary.org/obo/GO_1905420>	"vascular smooth muscle cell differentiation involved in phenotypic switching"
