defined_class	defined_class_label	entity	entity_label
http://purl.obolibrary.org/obo/GO_0150031	regulation of protein localization to lysosome	http://purl.obolibrary.org/obo/GO_0061462	protein localization to lysosome
http://purl.obolibrary.org/obo/GO_0140433	regulation of protein localization to meiotic spindle pole body	http://purl.obolibrary.org/obo/GO_1902441	protein localization to meiotic spindle pole body
http://purl.obolibrary.org/obo/GO_0031647	regulation of protein stability	http://purl.obolibrary.org/obo/OBA_0000128	protein stability
http://purl.obolibrary.org/obo/GO_0150073	regulation of protein-glutamine gamma-glutamyltransferase activity	http://purl.obolibrary.org/obo/GO_0003810	protein-glutamine gamma-glutamyltransferase activity
http://purl.obolibrary.org/obo/GO_0044357	regulation of rRNA stability	http://purl.obolibrary.org/obo/OBA_0000129	rRNA stability
http://purl.obolibrary.org/obo/GO_1905945	regulation of response to calcium ion	http://purl.obolibrary.org/obo/GO_0051592	response to calcium ion
http://purl.obolibrary.org/obo/GO_0060075	regulation of resting membrane potential	http://purl.obolibrary.org/obo/OBA_0000134	resting membrane potential
http://purl.obolibrary.org/obo/GO_0140500	regulation of reticulophagy	http://purl.obolibrary.org/obo/GO_0061709	reticulophagy
http://purl.obolibrary.org/obo/GO_1903395	regulation of secondary cell septum biogenesis	http://purl.obolibrary.org/obo/GO_1990344	secondary cell septum biogenesis
http://purl.obolibrary.org/obo/GO_0048172	regulation of short-term neuronal synaptic plasticity	http://purl.obolibrary.org/obo/OBA_0000136	short-term neuronal synaptic plasticity
http://purl.obolibrary.org/obo/GO_0106159	regulation of small RNA loading onto RISC	http://purl.obolibrary.org/obo/GO_0070922	small RNA loading onto RISC
http://purl.obolibrary.org/obo/GO_0090225	regulation of spindle density	http://purl.obolibrary.org/obo/OBA_0000138	spindle density
http://purl.obolibrary.org/obo/GO_0075223	regulation of sporangium germination	http://purl.obolibrary.org/obo/GO_0075222	sporangium germination
http://purl.obolibrary.org/obo/GO_0106118	regulation of sterol biosynthetic process	http://purl.obolibrary.org/obo/GO_0016126	sterol biosynthetic process
http://purl.obolibrary.org/obo/GO_0050803	regulation of synapse structure or activity	http://purl.obolibrary.org/obo/OBA_0000139	synapse structure and activity
http://purl.obolibrary.org/obo/GO_0031916	regulation of synaptic metaplasticity	http://purl.obolibrary.org/obo/OBA_0000140	synaptic metaplasticity
http://purl.obolibrary.org/obo/GO_0048167	regulation of synaptic plasticity	http://purl.obolibrary.org/obo/OBA_0000141	synaptic plasticity
http://purl.obolibrary.org/obo/GO_0150045	regulation of synaptic signaling by nitric oxide	http://purl.obolibrary.org/obo/GO_0099163	synaptic signaling by nitric oxide
http://purl.obolibrary.org/obo/GO_0003073	regulation of systemic arterial blood pressure	http://purl.obolibrary.org/obo/OBA_0000143	systemic arterial blood pressure
http://purl.obolibrary.org/obo/GO_0090067	regulation of thalamus size	http://purl.obolibrary.org/obo/OBA_0000160	thalamus size
http://purl.obolibrary.org/obo/GO_0002026	regulation of the force of heart contraction	http://purl.obolibrary.org/obo/OBA_0000161	force of heart contraction
http://purl.obolibrary.org/obo/GO_0014729	regulation of the velocity of shortening of skeletal muscle modulating contraction	http://purl.obolibrary.org/obo/OBA_0000164	velocity of shortening of skeletal muscle modulating contraction
http://purl.obolibrary.org/obo/GO_0150035	regulation of trans-synaptic signaling by BDNF, modulating synaptic transmission	http://purl.obolibrary.org/obo/GO_0099183	trans-synaptic signaling by BDNF, modulating synaptic transmission
http://purl.obolibrary.org/obo/GO_0150036	regulation of trans-synaptic signaling by endocannabinoid, modulating synaptic transmission	http://purl.obolibrary.org/obo/GO_0099553	trans-synaptic signaling by endocannabinoid, modulating synaptic transmission
http://purl.obolibrary.org/obo/GO_0150111	regulation of transepithelial transport	http://purl.obolibrary.org/obo/GO_0070633	transepithelial transport
http://purl.obolibrary.org/obo/GO_0071634	regulation of transforming growth factor beta production	http://purl.obolibrary.org/obo/GO_0071604	transforming growth factor beta production
http://purl.obolibrary.org/obo/GO_0006450	regulation of translational fidelity	http://purl.obolibrary.org/obo/OBA_0000169	translational accuracy
http://purl.obolibrary.org/obo/GO_0150200	regulation of transport across blood-brain barrier	http://purl.obolibrary.org/obo/GO_0150104	transport across blood-brain barrier
http://purl.obolibrary.org/obo/GO_0035296	regulation of tube diameter	http://purl.obolibrary.org/obo/OBA_0000171	tube diameter
http://purl.obolibrary.org/obo/GO_0035158	regulation of tube diameter, open tracheal system	http://purl.obolibrary.org/obo/OBA_0000166	tracheal tube diameter
http://purl.obolibrary.org/obo/GO_0035159	regulation of tube length, open tracheal system	http://purl.obolibrary.org/obo/OBA_0000167	tracheal tube length
http://purl.obolibrary.org/obo/GO_0035150	regulation of tube size	http://purl.obolibrary.org/obo/OBA_0000172	tube size
http://purl.obolibrary.org/obo/GO_0150067	regulation of tubulin deacetylase activity	http://purl.obolibrary.org/obo/GO_0042903	tubulin deacetylase activity
http://purl.obolibrary.org/obo/GO_0035809	regulation of urine volume	http://purl.obolibrary.org/obo/OBA_0000173	urinary volume
http://purl.obolibrary.org/obo/GO_1905930	regulation of vascular associated smooth muscle cell differentiation involved in phenotypic switching	http://purl.obolibrary.org/obo/GO_1905420	vascular associated smooth muscle cell differentiation involved in phenotypic switching
http://purl.obolibrary.org/obo/GO_0043114	regulation of vascular permeability	http://purl.obolibrary.org/obo/OBA_0000174	vascular permeability
http://purl.obolibrary.org/obo/GO_0106214	regulation of vesicle fusion with Golgi apparatus	http://purl.obolibrary.org/obo/GO_0048280	vesicle fusion with Golgi apparatus
