defined_class	defined_class_label	target1	target1_label	target2	target2_label
http://purl.obolibrary.org/obo/GO_0010649	regulation of cell communication by electrical coupling	http://purl.obolibrary.org/obo/GO_0008150	biological_process	http://purl.obolibrary.org/obo/GO_0010644	cell communication by electrical coupling
http://purl.obolibrary.org/obo/GO_0051726	regulation of cell cycle	http://purl.obolibrary.org/obo/GO_0008150	biological_process	http://purl.obolibrary.org/obo/GO_0007049	cell cycle
http://purl.obolibrary.org/obo/GO_0071156	regulation of cell cycle arrest	http://purl.obolibrary.org/obo/GO_0008150	biological_process	http://purl.obolibrary.org/obo/GO_0007050	cell cycle arrest
http://purl.obolibrary.org/obo/GO_1901976	regulation of cell cycle checkpoint	http://purl.obolibrary.org/obo/GO_0008150	biological_process	http://purl.obolibrary.org/obo/GO_0000075	cell cycle checkpoint
http://purl.obolibrary.org/obo/GO_0110044	regulation of cell cycle switching, mitotic to meiotic cell cycle	http://purl.obolibrary.org/obo/GO_0008150	biological_process	http://purl.obolibrary.org/obo/GO_0051728	cell cycle switching, mitotic to meiotic cell cycle
http://purl.obolibrary.org/obo/GO_0010941	regulation of cell death	http://purl.obolibrary.org/obo/GO_0008150	biological_process	http://purl.obolibrary.org/obo/GO_0008219	cell death
http://purl.obolibrary.org/obo/GO_0060284	regulation of cell development	http://purl.obolibrary.org/obo/GO_0008150	biological_process	http://purl.obolibrary.org/obo/GO_0048468	cell development
http://purl.obolibrary.org/obo/GO_0045595	regulation of cell differentiation	http://purl.obolibrary.org/obo/GO_0008150	biological_process	http://purl.obolibrary.org/obo/GO_0030154	cell differentiation
http://purl.obolibrary.org/obo/GO_0060800	regulation of cell differentiation involved in embryonic placenta development	http://purl.obolibrary.org/obo/GO_0008150	biological_process	http://purl.obolibrary.org/obo/GO_0060706	cell differentiation involved in embryonic placenta development
http://purl.obolibrary.org/obo/GO_0051302	regulation of cell division	http://purl.obolibrary.org/obo/GO_0008150	biological_process	http://purl.obolibrary.org/obo/GO_0051301	cell division
http://purl.obolibrary.org/obo/GO_0010453	regulation of cell fate commitment	http://purl.obolibrary.org/obo/GO_0008150	biological_process	http://purl.obolibrary.org/obo/GO_0045165	cell fate commitment
http://purl.obolibrary.org/obo/GO_1905933	regulation of cell fate determination	http://purl.obolibrary.org/obo/GO_0065007	biological regulation	http://purl.obolibrary.org/obo/GO_0001709	cell fate determination
http://purl.obolibrary.org/obo/GO_0042659	regulation of cell fate specification	http://purl.obolibrary.org/obo/GO_0008150	biological_process	http://purl.obolibrary.org/obo/GO_0001708	cell fate specification
http://purl.obolibrary.org/obo/GO_0001558	regulation of cell growth	http://purl.obolibrary.org/obo/GO_0008150	biological_process	http://purl.obolibrary.org/obo/GO_0016049	cell growth
http://purl.obolibrary.org/obo/GO_0061050	regulation of cell growth involved in cardiac muscle cell development	http://purl.obolibrary.org/obo/GO_0008150	biological_process	http://purl.obolibrary.org/obo/GO_0061049	cell growth involved in cardiac muscle cell development
http://purl.obolibrary.org/obo/GO_0031341	regulation of cell killing	http://purl.obolibrary.org/obo/GO_0008150	biological_process	http://purl.obolibrary.org/obo/GO_0001906	cell killing
http://purl.obolibrary.org/obo/GO_1903429	regulation of cell maturation	http://purl.obolibrary.org/obo/GO_0008150	biological_process	http://purl.obolibrary.org/obo/GO_0048469	cell maturation
http://purl.obolibrary.org/obo/GO_0030334	regulation of cell migration	http://purl.obolibrary.org/obo/GO_0008150	biological_process	http://purl.obolibrary.org/obo/GO_0016477	cell migration
http://purl.obolibrary.org/obo/GO_2000145	regulation of cell motility	http://purl.obolibrary.org/obo/GO_0008150	biological_process	http://purl.obolibrary.org/obo/GO_0048870	cell motility
http://purl.obolibrary.org/obo/GO_0042127	regulation of cell population proliferation	http://purl.obolibrary.org/obo/GO_0008150	biological_process	http://purl.obolibrary.org/obo/GO_0008283	cell population proliferation
http://purl.obolibrary.org/obo/GO_0060491	regulation of cell projection assembly	http://purl.obolibrary.org/obo/GO_0008150	biological_process	http://purl.obolibrary.org/obo/GO_0030031	cell projection assembly
http://purl.obolibrary.org/obo/GO_0031344	regulation of cell projection organization	http://purl.obolibrary.org/obo/GO_0008150	biological_process	http://purl.obolibrary.org/obo/GO_0030030	cell projection organization
http://purl.obolibrary.org/obo/GO_0071863	regulation of cell proliferation in bone marrow	http://purl.obolibrary.org/obo/GO_0008150	biological_process	http://purl.obolibrary.org/obo/GO_0071838	cell proliferation in bone marrow
http://purl.obolibrary.org/obo/GO_0021921	regulation of cell proliferation in dorsal spinal cord	http://purl.obolibrary.org/obo/GO_0008150	biological_process	http://purl.obolibrary.org/obo/GO_0010456	cell proliferation in dorsal spinal cord
http://purl.obolibrary.org/obo/GO_1904933	regulation of cell proliferation in midbrain	http://purl.obolibrary.org/obo/GO_0008150	biological_process	http://purl.obolibrary.org/obo/GO_0033278	cell proliferation in midbrain
http://purl.obolibrary.org/obo/GO_1903338	regulation of cell wall organization or biogenesis	http://purl.obolibrary.org/obo/GO_0008150	biological_process	http://purl.obolibrary.org/obo/GO_0071554	cell wall organization or biogenesis
http://purl.obolibrary.org/obo/GO_0022407	regulation of cell-cell adhesion	http://purl.obolibrary.org/obo/GO_0008150	biological_process	http://purl.obolibrary.org/obo/GO_0098609	cell-cell adhesion
http://purl.obolibrary.org/obo/GO_0070587	regulation of cell-cell adhesion involved in gastrulation	http://purl.obolibrary.org/obo/GO_0008150	biological_process	http://purl.obolibrary.org/obo/GO_0070586	cell-cell adhesion involved in gastrulation
http://purl.obolibrary.org/obo/GO_2000047	regulation of cell-cell adhesion mediated by cadherin	http://purl.obolibrary.org/obo/GO_0008150	biological_process	http://purl.obolibrary.org/obo/GO_0044331	cell-cell adhesion mediated by cadherin
http://purl.obolibrary.org/obo/GO_0001952	regulation of cell-matrix adhesion	http://purl.obolibrary.org/obo/GO_0065007	biological regulation	http://purl.obolibrary.org/obo/GO_0007160	cell-matrix adhesion
http://purl.obolibrary.org/obo/GO_0010810	regulation of cell-substrate adhesion	http://purl.obolibrary.org/obo/GO_0065007	biological regulation	http://purl.obolibrary.org/obo/GO_0031589	cell-substrate adhesion
http://purl.obolibrary.org/obo/GO_1900419	regulation of cellular alcohol catabolic process	http://purl.obolibrary.org/obo/GO_0008150	biological_process	http://purl.obolibrary.org/obo/GO_0044109	cellular alcohol catabolic process
http://purl.obolibrary.org/obo/GO_0034251	regulation of cellular amide catabolic process	http://purl.obolibrary.org/obo/GO_0008150	biological_process	http://purl.obolibrary.org/obo/GO_0043605	cellular amide catabolic process
http://purl.obolibrary.org/obo/GO_0034248	regulation of cellular amide metabolic process	http://purl.obolibrary.org/obo/GO_0008150	biological_process	http://purl.obolibrary.org/obo/GO_0043603	cellular amide metabolic process
http://purl.obolibrary.org/obo/GO_0033238	regulation of cellular amine metabolic process	http://purl.obolibrary.org/obo/GO_0008150	biological_process	http://purl.obolibrary.org/obo/GO_0044106	cellular amine metabolic process
http://purl.obolibrary.org/obo/GO_0006521	regulation of cellular amino acid metabolic process	http://purl.obolibrary.org/obo/GO_0008150	biological_process	http://purl.obolibrary.org/obo/GO_0006520	cellular amino acid metabolic process
http://purl.obolibrary.org/obo/GO_0031326	regulation of cellular biosynthetic process	http://purl.obolibrary.org/obo/GO_0008150	biological_process	http://purl.obolibrary.org/obo/GO_0044249	cellular biosynthetic process
http://purl.obolibrary.org/obo/GO_0043471	regulation of cellular carbohydrate catabolic process	http://purl.obolibrary.org/obo/GO_0008150	biological_process	http://purl.obolibrary.org/obo/GO_0044275	cellular carbohydrate catabolic process
http://purl.obolibrary.org/obo/GO_0010675	regulation of cellular carbohydrate metabolic process	http://purl.obolibrary.org/obo/GO_0008150	biological_process	http://purl.obolibrary.org/obo/GO_0044262	cellular carbohydrate metabolic process
http://purl.obolibrary.org/obo/GO_0031329	regulation of cellular catabolic process	http://purl.obolibrary.org/obo/GO_0008150	biological_process	http://purl.obolibrary.org/obo/GO_0044248	cellular catabolic process
http://purl.obolibrary.org/obo/GO_0044087	regulation of cellular component biogenesis	http://purl.obolibrary.org/obo/GO_0008150	biological_process	http://purl.obolibrary.org/obo/GO_0044085	cellular component biogenesis
http://purl.obolibrary.org/obo/GO_0051270	regulation of cellular component movement	http://purl.obolibrary.org/obo/GO_0008150	biological_process	http://purl.obolibrary.org/obo/GO_0006928	movement of cell or subcellular component
http://purl.obolibrary.org/obo/GO_0051128	regulation of cellular component organization	http://purl.obolibrary.org/obo/GO_0008150	biological_process	http://purl.obolibrary.org/obo/GO_0016043	cellular component organization
http://purl.obolibrary.org/obo/GO_0010185	regulation of cellular defense response	http://purl.obolibrary.org/obo/GO_0008150	biological_process	http://purl.obolibrary.org/obo/GO_0006968	cellular defense response
http://purl.obolibrary.org/obo/GO_0002691	regulation of cellular extravasation	http://purl.obolibrary.org/obo/GO_0008150	biological_process	http://purl.obolibrary.org/obo/GO_0045123	cellular extravasation
http://purl.obolibrary.org/obo/GO_1900069	regulation of cellular hyperosmotic salinity response	http://purl.obolibrary.org/obo/GO_0008150	biological_process	http://purl.obolibrary.org/obo/GO_0071475	cellular hyperosmotic salinity response
http://purl.obolibrary.org/obo/GO_0010565	regulation of cellular ketone metabolic process	http://purl.obolibrary.org/obo/GO_0008150	biological_process	http://purl.obolibrary.org/obo/GO_0042180	cellular ketone metabolic process
http://purl.obolibrary.org/obo/GO_0060341	regulation of cellular localization	http://purl.obolibrary.org/obo/GO_0008150	biological_process	http://purl.obolibrary.org/obo/GO_0051641	cellular localization
http://purl.obolibrary.org/obo/GO_2000112	regulation of cellular macromolecule biosynthetic process	http://purl.obolibrary.org/obo/GO_0008150	biological_process	http://purl.obolibrary.org/obo/GO_0034645	cellular macromolecule biosynthetic process
http://purl.obolibrary.org/obo/GO_0031323	regulation of cellular metabolic process	http://purl.obolibrary.org/obo/GO_0008150	biological_process	http://purl.obolibrary.org/obo/GO_0044237	cellular metabolic process
http://purl.obolibrary.org/obo/GO_0090348	regulation of cellular organofluorine metabolic process	http://purl.obolibrary.org/obo/GO_0008150	biological_process	http://purl.obolibrary.org/obo/GO_0090346	cellular organofluorine metabolic process
http://purl.obolibrary.org/obo/GO_0090347	regulation of cellular organohalogen metabolic process	http://purl.obolibrary.org/obo/GO_0008150	biological_process	http://purl.obolibrary.org/obo/GO_0090345	cellular organohalogen metabolic process
http://purl.obolibrary.org/obo/GO_0050794	regulation of cellular process	http://purl.obolibrary.org/obo/GO_0065007	biological regulation	http://purl.obolibrary.org/obo/GO_0009987	cellular process
http://purl.obolibrary.org/obo/GO_1903362	regulation of cellular protein catabolic process	http://purl.obolibrary.org/obo/GO_0008150	biological_process	http://purl.obolibrary.org/obo/GO_0044257	cellular protein catabolic process
http://purl.obolibrary.org/obo/GO_1903827	regulation of cellular protein localization	http://purl.obolibrary.org/obo/GO_0008150	biological_process	http://purl.obolibrary.org/obo/GO_0034613	cellular protein localization
http://purl.obolibrary.org/obo/GO_0032268	regulation of cellular protein metabolic process	http://purl.obolibrary.org/obo/GO_0008150	biological_process	http://purl.obolibrary.org/obo/GO_0044267	cellular protein metabolic process
http://purl.obolibrary.org/obo/GO_0043457	regulation of cellular respiration	http://purl.obolibrary.org/obo/GO_0008150	biological_process	http://purl.obolibrary.org/obo/GO_0045333	cellular respiration
http://purl.obolibrary.org/obo/GO_2000683	regulation of cellular response to X-ray	http://purl.obolibrary.org/obo/GO_0008150	biological_process	http://purl.obolibrary.org/obo/GO_0071481	cellular response to X-ray
http://purl.obolibrary.org/obo/GO_1905957	regulation of cellular response to alcohol	http://purl.obolibrary.org/obo/GO_0065007	biological regulation	http://purl.obolibrary.org/obo/GO_0097306	cellular response to alcohol
http://purl.obolibrary.org/obo/GO_1900067	regulation of cellular response to alkaline pH	http://purl.obolibrary.org/obo/GO_0008150	biological_process	http://purl.obolibrary.org/obo/GO_0071469	cellular response to alkaline pH
http://purl.obolibrary.org/obo/GO_1903832	regulation of cellular response to amino acid starvation	http://purl.obolibrary.org/obo/GO_0008150	biological_process	http://purl.obolibrary.org/obo/GO_0034198	cellular response to amino acid starvation
http://purl.obolibrary.org/obo/GO_1905843	regulation of cellular response to gamma radiation	http://purl.obolibrary.org/obo/GO_0008150	biological_process	http://purl.obolibrary.org/obo/GO_0071480	cellular response to gamma radiation
http://purl.obolibrary.org/obo/GO_1904547	regulation of cellular response to glucose starvation	http://purl.obolibrary.org/obo/GO_0008150	biological_process	http://purl.obolibrary.org/obo/GO_0042149	cellular response to glucose starvation
http://purl.obolibrary.org/obo/GO_0090287	regulation of cellular response to growth factor stimulus	http://purl.obolibrary.org/obo/GO_0008150	biological_process	http://purl.obolibrary.org/obo/GO_0071363	cellular response to growth factor stimulus
http://purl.obolibrary.org/obo/GO_1900034	regulation of cellular response to heat	http://purl.obolibrary.org/obo/GO_0008150	biological_process	http://purl.obolibrary.org/obo/GO_0034605	cellular response to heat
http://purl.obolibrary.org/obo/GO_2001112	regulation of cellular response to hepatocyte growth factor stimulus	http://purl.obolibrary.org/obo/GO_0008150	biological_process	http://purl.obolibrary.org/obo/GO_0035729	cellular response to hepatocyte growth factor stimulus
http://purl.obolibrary.org/obo/GO_1900037	regulation of cellular response to hypoxia	http://purl.obolibrary.org/obo/GO_0008150	biological_process	http://purl.obolibrary.org/obo/GO_0071456	cellular response to hypoxia
http://purl.obolibrary.org/obo/GO_1900076	regulation of cellular response to insulin stimulus	http://purl.obolibrary.org/obo/GO_0008150	biological_process	http://purl.obolibrary.org/obo/GO_0032869	cellular response to insulin stimulus
http://purl.obolibrary.org/obo/GO_1901966	regulation of cellular response to iron ion starvation	http://purl.obolibrary.org/obo/GO_0008150	biological_process	http://purl.obolibrary.org/obo/GO_0010106	cellular response to iron ion starvation
http://purl.obolibrary.org/obo/GO_1903972	regulation of cellular response to macrophage colony-stimulating factor stimulus	http://purl.obolibrary.org/obo/GO_0008150	biological_process	http://purl.obolibrary.org/obo/GO_0036006	cellular response to macrophage colony-stimulating factor stimulus
http://purl.obolibrary.org/obo/GO_0106049	regulation of cellular response to osmotic stress	http://purl.obolibrary.org/obo/GO_0008150	biological_process	http://purl.obolibrary.org/obo/GO_0071470	cellular response to osmotic stress
http://purl.obolibrary.org/obo/GO_1900407	regulation of cellular response to oxidative stress	http://purl.obolibrary.org/obo/GO_0008150	biological_process	http://purl.obolibrary.org/obo/GO_0034599	cellular response to oxidative stress
http://purl.obolibrary.org/obo/GO_0140255	regulation of cellular response to phosphate starvation	http://purl.obolibrary.org/obo/GO_0065007	biological regulation	http://purl.obolibrary.org/obo/GO_0016036	cellular response to phosphate starvation
http://purl.obolibrary.org/obo/GO_0080135	regulation of cellular response to stress	http://purl.obolibrary.org/obo/GO_0008150	biological_process	http://purl.obolibrary.org/obo/GO_0033554	cellular response to stress
http://purl.obolibrary.org/obo/GO_1903844	regulation of cellular response to transforming growth factor beta stimulus	http://purl.obolibrary.org/obo/GO_0008150	biological_process	http://purl.obolibrary.org/obo/GO_0071560	cellular response to transforming growth factor beta stimulus
http://purl.obolibrary.org/obo/GO_1902547	regulation of cellular response to vascular endothelial growth factor stimulus	http://purl.obolibrary.org/obo/GO_0008150	biological_process	http://purl.obolibrary.org/obo/GO_0035924	cellular response to vascular endothelial growth factor stimulus
http://purl.obolibrary.org/obo/GO_2000772	regulation of cellular senescence	http://purl.obolibrary.org/obo/GO_0008150	biological_process	http://purl.obolibrary.org/obo/GO_0090398	cellular senescence
http://purl.obolibrary.org/obo/GO_0002914	regulation of central B cell anergy	http://purl.obolibrary.org/obo/GO_0008150	biological_process	http://purl.obolibrary.org/obo/GO_0002341	central B cell anergy
http://purl.obolibrary.org/obo/GO_0002895	regulation of central B cell tolerance induction	http://purl.obolibrary.org/obo/GO_0008150	biological_process	http://purl.obolibrary.org/obo/GO_0002510	central B cell tolerance induction
http://purl.obolibrary.org/obo/GO_0002646	regulation of central tolerance induction	http://purl.obolibrary.org/obo/GO_0008150	biological_process	http://purl.obolibrary.org/obo/GO_0002508	central tolerance induction
http://purl.obolibrary.org/obo/GO_0046599	regulation of centriole replication	http://purl.obolibrary.org/obo/GO_0008150	biological_process	http://purl.obolibrary.org/obo/GO_0007099	centriole replication
http://purl.obolibrary.org/obo/GO_0021936	regulation of cerebellar granule cell precursor proliferation	http://purl.obolibrary.org/obo/GO_0008150	biological_process	http://purl.obolibrary.org/obo/GO_0021930	cerebellar granule cell precursor proliferation
http://purl.obolibrary.org/obo/GO_1900646	regulation of chanoclavine-I aldehyde biosynthetic process	http://purl.obolibrary.org/obo/GO_0008150	biological_process	http://purl.obolibrary.org/obo/GO_1900569	chanoclavine-I aldehyde biosynthetic process
http://purl.obolibrary.org/obo/GO_1900643	regulation of chanoclavine-I biosynthetic process	http://purl.obolibrary.org/obo/GO_0008150	biological_process	http://purl.obolibrary.org/obo/GO_1900566	chanoclavine-I biosynthetic process
http://purl.obolibrary.org/obo/GO_1904714	regulation of chaperone-mediated autophagy	http://purl.obolibrary.org/obo/GO_0008150	biological_process	http://purl.obolibrary.org/obo/GO_0061684	chaperone-mediated autophagy
http://purl.obolibrary.org/obo/GO_1903644	regulation of chaperone-mediated protein folding	http://purl.obolibrary.org/obo/GO_0008150	biological_process	http://purl.obolibrary.org/obo/GO_0061077	chaperone-mediated protein folding
http://purl.obolibrary.org/obo/GO_0071652	regulation of chemokine (C-C motif) ligand 1 production	http://purl.obolibrary.org/obo/GO_0008150	biological_process	http://purl.obolibrary.org/obo/GO_0071610	chemokine (C-C motif) ligand 1 production
http://purl.obolibrary.org/obo/GO_1903884	regulation of chemokine (C-C motif) ligand 20 production	http://purl.obolibrary.org/obo/GO_0008150	biological_process	http://purl.obolibrary.org/obo/GO_0036392	chemokine (C-C motif) ligand 20 production
http://purl.obolibrary.org/obo/GO_0071643	regulation of chemokine (C-C motif) ligand 4 production	http://purl.obolibrary.org/obo/GO_0008150	biological_process	http://purl.obolibrary.org/obo/GO_0071606	chemokine (C-C motif) ligand 4 production
http://purl.obolibrary.org/obo/GO_0071649	regulation of chemokine (C-C motif) ligand 5 production	http://purl.obolibrary.org/obo/GO_0008150	biological_process	http://purl.obolibrary.org/obo/GO_0071609	chemokine (C-C motif) ligand 5 production
http://purl.obolibrary.org/obo/GO_0035531	regulation of chemokine (C-C motif) ligand 6 production	http://purl.obolibrary.org/obo/GO_0008150	biological_process	http://purl.obolibrary.org/obo/GO_0035530	chemokine (C-C motif) ligand 6 production
http://purl.obolibrary.org/obo/GO_2000338	regulation of chemokine (C-X-C motif) ligand 1 production	http://purl.obolibrary.org/obo/GO_0008150	biological_process	http://purl.obolibrary.org/obo/GO_0072566	chemokine (C-X-C motif) ligand 1 production
http://purl.obolibrary.org/obo/GO_2000341	regulation of chemokine (C-X-C motif) ligand 2 production	http://purl.obolibrary.org/obo/GO_0008150	biological_process	http://purl.obolibrary.org/obo/GO_0072567	chemokine (C-X-C motif) ligand 2 production
http://purl.obolibrary.org/obo/GO_0035394	regulation of chemokine (C-X-C motif) ligand 9 production	http://purl.obolibrary.org/obo/GO_0008150	biological_process	http://purl.obolibrary.org/obo/GO_0035393	chemokine (C-X-C motif) ligand 9 production
http://purl.obolibrary.org/obo/GO_0032642	regulation of chemokine production	http://purl.obolibrary.org/obo/GO_0008150	biological_process	http://purl.obolibrary.org/obo/GO_0032602	chemokine production
http://purl.obolibrary.org/obo/GO_0070099	regulation of chemokine-mediated signaling pathway	http://purl.obolibrary.org/obo/GO_0008150	biological_process	http://purl.obolibrary.org/obo/GO_0070098	chemokine-mediated signaling pathway
http://purl.obolibrary.org/obo/GO_1904365	regulation of chemokinesis	http://purl.obolibrary.org/obo/GO_0008150	biological_process	http://purl.obolibrary.org/obo/GO_0042466	chemokinesis
http://purl.obolibrary.org/obo/GO_0050920	regulation of chemotaxis	http://purl.obolibrary.org/obo/GO_0008150	biological_process	http://purl.obolibrary.org/obo/GO_0006935	chemotaxis
http://purl.obolibrary.org/obo/GO_1904552	regulation of chemotaxis to arachidonic acid	http://purl.obolibrary.org/obo/GO_0008150	biological_process	http://purl.obolibrary.org/obo/GO_0034670	chemotaxis to arachidonic acid
http://purl.obolibrary.org/obo/GO_0007564	regulation of chitin-based cuticle tanning	http://purl.obolibrary.org/obo/GO_0008150	biological_process	http://purl.obolibrary.org/obo/GO_0007593	chitin-based cuticle sclerotization
http://purl.obolibrary.org/obo/GO_0010380	regulation of chlorophyll biosynthetic process	http://purl.obolibrary.org/obo/GO_0008150	biological_process	http://purl.obolibrary.org/obo/GO_0015995	chlorophyll biosynthetic process
http://purl.obolibrary.org/obo/GO_0010271	regulation of chlorophyll catabolic process	http://purl.obolibrary.org/obo/GO_0008150	biological_process	http://purl.obolibrary.org/obo/GO_0015996	chlorophyll catabolic process
http://purl.obolibrary.org/obo/GO_1904054	regulation of cholangiocyte proliferation	http://purl.obolibrary.org/obo/GO_0008150	biological_process	http://purl.obolibrary.org/obo/GO_1990705	cholangiocyte proliferation
http://purl.obolibrary.org/obo/GO_0010872	regulation of cholesterol esterification	http://purl.obolibrary.org/obo/GO_0008150	biological_process	http://purl.obolibrary.org/obo/GO_0034435	cholesterol esterification
http://purl.obolibrary.org/obo/GO_0010885	regulation of cholesterol storage	http://purl.obolibrary.org/obo/GO_0008150	biological_process	http://purl.obolibrary.org/obo/GO_0010878	cholesterol storage
http://purl.obolibrary.org/obo/GO_0061181	regulation of chondrocyte development	http://purl.obolibrary.org/obo/GO_0008150	biological_process	http://purl.obolibrary.org/obo/GO_0002063	chondrocyte development
http://purl.obolibrary.org/obo/GO_0032330	regulation of chondrocyte differentiation	http://purl.obolibrary.org/obo/GO_0008150	biological_process	http://purl.obolibrary.org/obo/GO_0002062	chondrocyte differentiation
http://purl.obolibrary.org/obo/GO_1902738	regulation of chondrocyte differentiation involved in endochondral bone morphogenesis	http://purl.obolibrary.org/obo/GO_0008150	biological_process	http://purl.obolibrary.org/obo/GO_0003413	chondrocyte differentiation involved in endochondral bone morphogenesis
http://purl.obolibrary.org/obo/GO_1903041	regulation of chondrocyte hypertrophy	http://purl.obolibrary.org/obo/GO_0008150	biological_process	http://purl.obolibrary.org/obo/GO_0003415	chondrocyte hypertrophy
http://purl.obolibrary.org/obo/GO_0010847	regulation of chromatin assembly	http://purl.obolibrary.org/obo/GO_0008150	biological_process	http://purl.obolibrary.org/obo/GO_0031497	chromatin assembly
http://purl.obolibrary.org/obo/GO_0001672	regulation of chromatin assembly or disassembly	http://purl.obolibrary.org/obo/GO_0008150	biological_process	http://purl.obolibrary.org/obo/GO_0006333	chromatin assembly or disassembly
http://purl.obolibrary.org/obo/GO_0010848	regulation of chromatin disassembly	http://purl.obolibrary.org/obo/GO_0008150	biological_process	http://purl.obolibrary.org/obo/GO_0031498	chromatin disassembly
http://purl.obolibrary.org/obo/GO_1902275	regulation of chromatin organization	http://purl.obolibrary.org/obo/GO_0008150	biological_process	http://purl.obolibrary.org/obo/GO_0006325	chromatin organization
http://purl.obolibrary.org/obo/GO_0031935	regulation of chromatin silencing	http://purl.obolibrary.org/obo/GO_0008150	biological_process	http://purl.obolibrary.org/obo/GO_0006342	chromatin silencing
http://purl.obolibrary.org/obo/GO_0060623	regulation of chromosome condensation	http://purl.obolibrary.org/obo/GO_0008150	biological_process	http://purl.obolibrary.org/obo/GO_0030261	chromosome condensation
